dimensions,title,photo,technique,credittext,artyear,link,artdesc,nationality,artist,artist_birth,artist_death,production_id
8 7/8 x 11 7/8 inches,Untitled [O'Connor-Thaw 770,http://www.mfah.org/site_media/cache/61/dc/61dc2bccef9288068c7b5d314e37fe40.jpg,Brown ink on paper,Gift of Caroline Wiess Law,1946-1947,http://www.mfah.org/art/100-highlights/untitled-oconnor-thaw-770/,"This untitled drawing is from a suite of nine sketchbook drawings that established Jackson Pollock as one of the great draftsmen of the 20th century. Based on style, the sketchbook dates to about 1946 or 1947, not long before Pollock's breakthrough into the dripped-and-poured style of his mature period. A Suite of Notebook Drawings Pollock did not possess a natural ability for representational drawing, but these images, created after Old Master paintings, reveal a brilliant grasp of compositional analysis. Collectively, they are a summation of Pollock's early influences, especially Pablo Picasso, Joan Mir\xf3, and the Surrealists. A visual declaration of independence, they reveal how Pollock not only absorbed the styles of these early European modernists but also forged ahead to create his own pictorial vocabulary. catalogue raisonn introduces a new type of draftsmanship emphasizing the immediacy of the artist's gesture, a fundamental component of Pollock's aesthetic. As Pollock never made preparatory drawings for his paintings, these images stand as independent works and are often referred to by their numbers. Here, O'Connor-Thaw is a reference to Francis Valentine O'Connor and Eugene Victor Thaw, who wrote the catalogue raisonn\xe9--the comprehensive catalogue of paintings, drawings, and other works--of Pollock's career. The energy with which these drawings pulsate also signals a new era in art history as the center of the art world shifted from Paris to New York City.",American,Jackson Pollock,1912,1956,e36831f284ca
19 x 29 inches,Indians Spear Fishing,http://www.mfah.org/site_media/cache/ff/9f/ff9fea54b1a17b6d105edc84218ac584.jpg,Oil on canvas,"Gift of the family of Joseph S. Cullinan, and Mr. and Mrs. David R. Wintermann, by exchange, with additional gifts from Mr. and Mrs. Harry C. Wiess; Mrs. E. L. Perry; Mr. and Mrs. John H. Blaffer in memory of his father, Robert Lee Blaffer; Edith A. and Percy S. Straus; Grand Central Art Galleries; Miss Ima Hogg; General and Mrs. Maurice Hirsch; the Allied Arts Association; Mr. and Mrs. Charles L. Bybee; Nan Greacen Faure; Helen M. Turner; Mr. and Mrs. Herbert Levine; the Axson Club, Houston; William Best; Sarah Campbell Blaffer; Mrs. Willimina Borland; Mrs. Evan W. Burris; the Houston Art League through the bequest of George M. Dickson; Miss Katherine S. Dreier; George Wharton Edwards; Parker Edwards; Mrs. William Stamps Farish; the Houston Friends of Art; Angela MacDonnell; Mrs. Justine Franklin McGuire; the Smithsonian Institution; Harmand Teplow; the University Club of Houston; Robert C. Vose, in memory of Seth M. Vose; Nelson Waggener; Emile Walters; and Irene Weir, all by exchange",1862,http://www.mfah.org/art/100-highlights/indians-spear-fishing/,"Landscape as a form of theater and spectacle culminated in 19th-century American art with the work of Thomas Moran and Albert Bierstadt. Both artists emigrated from Europe at young ages and went on to achieve success as interpreters of the American West. The new, epic landscape they depicted functioned as a national symbol of grandeur and promise, yet at the same time it served as rumination on the subject of nature and the divinity to be found within it. Indians Spear Fishing Bierstadt first left the East Coast to travel west in 1859, accompanying a government-sponsored trip from Missouri to the Rocky Mountains. Compiled from close observation, sketches, and stereoscopic views taken on the expedition, u portrays the West as a pristine, sublime wilderness that seemingly could be found only in the Bible's Book of Genesis. Within a compressed space, Bierstadt draws together barren rock formations, towering waterfalls, spindly trees, crystalline water reflecting rocky outcrops, and a peak that pierces the wispy and moisture-laden clouds, turning to mist below. In the brightly lit foreground near the shore, a boat filled with three Native Americans provides scale and identifies the location as unmistakably that of the West; the boat laden with furs spells the riches of the land,","American, born Germany",Albert Bierstadt,1830,1902,e5d8725d6242
17  x 24 inches,Untitled 11A,http://www.mfah.org/site_media/cache/ef/23/ef23aa3781cc431f3cc049ccafc25539.jpg,Oil on canvas,Gift of Duke Energy,1958,http://www.mfah.org/art/100-highlights/untitled-11a/,"With its acid palette and claustrophobic horizon, this painting captures the sense of primal creation Forrest Bess sought in his work. I felt it had something to do with a lonely beach, he wrote. The sharp pointed shapes brought to mind driftwood-the silhouette of driftwood on a beach. ideograms The son of an itinerant oil laborer, Bess grew up in the oil fields of East Texas. Living and working outside the mainstream art community, he developed a body of paintings unique in their visionary potency and abstract simplicity. In 1946, after several years in the Army Corps of Engineers, he suffered an emotional breakdown and began to experience frequent visions. He recorded them at first on a notepad by his bedside, then on canvas. These visions were often simple abstract forms or combinations of forms that appeared to Bess as symbols he called Untitled 11A . Using small canvases and a limited palette, he documented these symbols of his unconscious without, as he claimed, any reinterpretation. The clarity and simplicity of , and the manner in which it was painted, belie the complexity of its significance for Bess. This painting stands at the forefront of his visionary evocations of land, sea, and sky.",American,Forrest Bess,1911,1977,f629ffaae02c
8 x 5 3/16 inches,Samuel Houston,http://www.mfah.org/site_media/cache/6d/35/6d35345d2637a64b1f2fb75d67a243ad.jpg,Daguerreotype,Gift of Vinson & Elkins L.L.P. in honor of the firm's 75th anniversary,1851,http://www.mfah.org/art/100-highlights/samuel-houston/,"Texas statesman Sam Houston commissioned this photograph when he was contemplating a run for the presidency of the United States. By placing him next to a column in a relaxed pose, the portrait is carefully crafted to emphasize Houston's leadership qualities. The camera\xb4s capacity to document people, places, and events was the primary impetus for early photographers such as the Meade Brothers, who took this rare daguerreotype in 1851. In photography studios of this period, daguerreotype portraits were priced by plate size. This full-plate image is the only known existing full-length portrait of Houston, who stood 6 feet 2 inches tall. As the leader of the Texas Revolution and two-term president of the short-lived Republic of Texas, Houston was a knowledgeable frontiersman and liked to dress the part. However, this portrait shows him in more-conservative attire, probably to garner mass appeal for a presidential run. uThe Meade Brothers established one of the most successful photography studios in America, capturing famous subjects including Kit Carson and Commodore Matthew Perry. This portrait was probably taken in the brothers' New York studio the year after its opening, in 1850. Growing competition between portrait studios at the time led them to offer diverse options. Here, a papier-m\xe2ch\xe9 column demonstrates the trend toward incorporating props into portraiture, This work is rare because it is a full-plate image of a recognized subject by a recognized studio. The lithograph of this photograph enabled the image to appear in publications, but the daguerreotype was long thought to be lost. Discovered in 1990, it was acquired by the MFAH shortly thereafter.","American, born England;American, born England",Charles Richard Meade;Henry Meade,1826,1858,5e96d9c5301c
86 1/2 x 131 9/16 x 1 3/4 inches,A Wooded Landscape in Three Panels,http://www.mfah.org/site_media/cache/69/21/692168b1b4917e6d4fe24d5a3f09d474.jpg,"Glass, copper-foil, and lead",Museum purchase with funds provided by the; Brown Foundation Accessions Endowment Fund,1905,http://www.mfah.org/art/100-highlights/wooded-landscape-three-panels/,"This spectacular window is a unified forest scene spanning three panels. Like a living landscape, during the course of a day the scene changes in appearance, responding to the light surrounding it. A Wooded Landscape is far more complex than most stained-glass windows, which are pieced together in a process similar to solving a jigsaw puzzle. Instead, by layering different textures, thicknesses, and colors of glass on top of each other within the window-just as an artist might layer paint on a canvas-Louis Comfort Tiffany created subtle color combinations that change with variations in light. During his lifetime, it was said that Tiffany ""painted"" with glass.",American;New York,Louis Comfort Tiffany,1848,1933,b979a734b5f9
Stone: 18 3/4 x 23 3/4 inches; Sheet: 20 1/4 x 25 3/4 inches,A Stag at Sharkey's,http://www.mfah.org/site_media/cache/53/81/5381d4c7e17b8628d7e57a581afb5b5f.jpg,Lithograph,"Museum purchase with funds provided by ""One Great Night in November, 1989""",1917,http://www.mfah.org/art/100-highlights/stag-sharkeys/,"American artist George Bellows focused on images of urban realism. A Stag at Sharkeys , based on his 1909 oil painting, is one of the most iconic images of 20th-century American printmaking. Bellows was a member of an artists' group in New York City known as the Ashcan School. His first studio was located on Broadway opposite the Sharkey Athletic Club, where the law permitted members to see illegal prize fights, or ""stags."" Prizefighting clubs like Sharkey's were often condemned as sordid spaces, and this print captures that tawdry underworld. Arranged in a pyramid-like composition recalling classical sculpture, the anonymous fighters appear in an interlocking form with bold diagonal lines. The voyeuristic spectators, who are enthralled by the dramatic fight, represent a range of social types, from laborers to businessmen. Encouraging a favored fighter and reacting to and with the punches until the bout's end, the spectators are vicarious participants in the fight. Bellows is believed to have included himself as the second spectator to the referee's right, with just an eye and balding head peeping over the raised floor.",American,George Bellows,1882,1925,10b6c96506d7
27 1/4 x 40 1/8 inches,Fight for the Waterhole,http://www.mfah.org/site_media/cache/80/57/8057191552aab3e3e8942f1f1aa136cd.jpg,Oil on canvas,"The Hogg Brothers Collection, gift of Miss Ima Hogg",1903,http://www.mfah.org/art/100-highlights/fight-waterhole/,"One of Frederic Remington's masterpieces, this painting depicts cowboys hiding in a waterhole, their source of survival in the arid desert and of protection from the pursuing Plains Indians. The manipulated perspective gives the scene a panoramic quality and introduces a large shadow to convey the idea of ""passing""-the ever-present threat of death looming in the Western territories during the Indian Wars, as well as the passing of the West itself. Fight for the Waterhole As an illustrator, painter, sculptor, and writer, Remington created a popular image of the American West as a heroic battleground for U.S. westward expansion. His knowledge of the West grew from his frequent trips there to make sketches, take photographs, and buy the artifacts of Native American cultures and Western frontier life. Back in his studio near New York City, he chronicled vanquished Native American cultures and created images that popularized the cowboy as a national folk hero. Colliers Weekly was published in 1903 in u as part of Remington's four-year contract with the magazine to reproduce one painting each month. This alliance encouraged Remington to experiment with his technique, and as seen here, the results included looser brushwork, refined compositions, a bolder palette, and the development of psychological qualities in his art.",American,Frederic Remington,1861,1909,739ba591024b
32 3/8 x 42 3/8 inches,Peaceable Kingdom,http://www.mfah.org/site_media/cache/80/d3/80d3cff2300e710a11db16b382c8279d.jpg,Oil on canvas,The Bayou Bend Collection; Gift of Miss Ima Hogg,1826-1828,http://www.mfah.org/art/100-highlights/peaceable-kingdom/,"This painting is one of eight known versions that include rhymes in the borders referring to the biblical prophecy of Isaiah, which expresses the hope and promise of peace on earth. The words also allude to a historical event: William Penn's , which Edward Hicks believed to represent a partial fulfillment of Isaiah's prophecy, with the Quakers establishing a peaceable kingdom on earth. Few American artists are as beloved as Hicks, a devout Pennsylvania Quaker preacher and painter whose fascination with the religious theme of the peaceable kingdom constitutes one of the most popular and complex stories in American art. Toylike animals; placid landscape scenes, mostly of the Delaware Water Gap; and renditions of Penn's treaty consistently populate Hicks's kingdoms-so peaceable in their ideal of universal harmony, yet weighted with national and religious concerns of the time. Naively and at times crudely painted, Hicks's canvases nonetheless radiate passion and charm, and their underlying sources and motivations suggest a rare complexity in the field of so-called American ""folk art.""",American,Edward Hicks,1780,1849,4285576fbc31
55 x 79 5/16 inches,Wotan,http://www.mfah.org/site_media/cache/c3/16/c3165b9fdcd89c967c107f0ccb59c917.jpg,Oil on canvas mounted on Masonite,"Museum purchase, by exchange",1950,http://www.mfah.org/art/100-highlights/wotan/,"In the early 1950s, Franz Kline began paring down his paintings, purging them of all color and representational references. Wotan is one of his most austere compositions, focused simply on the stark contrast between his black brushstrokes and their white background. Kline insisted that all areas of his canvases were equal in weight: ""I paint the white as well as the black, and the white is just as important."" Wotan uThis iconic image records the power of the artist's vision and the authority of his gesture. The title, , u, refers to a Germanic deity of the pre-Christian era. A king of the gods, Wotan could also assume the role of wanderer, seer, and poet. Additionally, Wotan was a central character in Richard Wagner's , operas, which Kline often listened to in the art studio. For Kline, the title is not intended to describe the character of his painting; rather, by summoning up a mythic past, Kline claims a similar timelessness for his bold and revolutionary work.",American,Franz Kline,1910,1962,16d8ca4943cc
16  x 13  inches,Sampler,http://www.mfah.org/site_media/cache/45/98/459821eff32bffa708b3b12f1a045e52.jpg,Silk on linen,The Bayou Bend Collection; Gift of the Houston Junior Woman's Club in honor; of their forty years of service to Bayou Bend,1793,http://www.mfah.org/art/detail/sampler/,"Textiles are celebrated as the principal and most vibrant contribution that early American girls and women made to the decorative arts. The style of this sampler emerged from early girls' academies in Providence and Warren, Rhode Island, established and run during and after the American Revolution by widows to support their children. Joanna Maxwell stitched this sampler at age 11. She lived her life in the seaport town of Warren, and this example, dated 1793 and bearing the phrase ""Wrought in Warren,"" is the earliest known of a distinguished group. It depicts a pastoral scene of adults and children among animals and foliage, with lines of an acrostic verse praising truth, wisdom, God, and goodness stitched in the center, the first letter of each verse spelling out Joanna's name when viewed in a vertical orientation. Her sampler is beautifully executed, and more than two centures later, the needlework retains much of its original color and brilliancy.",American,Joanna Maxwell,1782,1847,f8f4eb4804ba
41 3/8 x 37 1/2 x 19 1/2 inches,Tambour Desk,http://www.mfah.org/site_media/cache/6b/59/6b59e32b8b2c6a57f0a5076411020b0c.jpg,"Mahogany, inlay, enameled brass, eastern white pine, and red oak",The Bayou Bend Collection; Gift of Miss Ima Hogg,1794-1810,http://www.mfah.org/art/detail/tambour-desk/,"The tambour desk was a new and innovative form that reflects the increasingly important place of women in American society in the early 19th century, as well as the growing international influence on American furniture design. Rather than relying on English design sources, the desk appears to be related to a small group of furniture influenced by contemporary French models, in this instance the bonheur du jour , or small writing table, of the Louis XVI period (1774-1793). The desk enjoyed great popularity in Boston and in the cabinetmaking centers north of the city. Exhibited in the Federal Parlor at Bayou Bend, this example bears the script initials ""TS"" and is similar to a desk with a paper label bearing the names of John and Thomas Seymour. Although these relationships strengthen the attribution to the Seymours' shop, they are not sufficient to attribute the desk to a specific maker. Thomas Seymour's own advertisements specify that the furniture was made not by but ""under the direction of Thomas Seymour. Whether this elegant desk represents the work of an individual or a group, the accomplished results epitomize the cabinetmakers' sensitive interpretations of the Neoclassical style in America, through the drawer pulls of English enamel, light-colored inlay, and delicate inlaid swags on the sliding tambour front.",Boston,Thomas Seymour,1794,1804,eb295e99aa9e
34 1/2 x 20 x 20 1/2 inches,Pair of Side Chairs,http://www.mfah.org/site_media/cache/d9/6f/d96f284349056f1b09eec30ad445d408.jpg,"Gessoed, painted and gilded yellow poplar, oak, maple, and eastern white pine with cane",The Bayou Bend Collection; Museum purchase with funds provided; by the Agnes Cullen Arnold Endowment Fund,1808,http://www.mfah.org/art/detail/pair-side-chairs/,"Architect Benjamin Henry Latrobe regularly designed furniture for many of his commissions, including painted furniture for Dolley and President James Madison for the White House that was destroyed in the burning of Washington, D.C, in 1814, as well as the furniture for the Philadelphia merchant William Waln. klismos This pair of chairs is part of an extensive suite of furniture made for Waln to furnish a new house that Latrobe designed for him between 1805 and 1808. Latrobe's relatively archaeologically correct interpretation of the Greek form draws on the designs of Thomas Hope published shortly before and represents perhaps the earliest documented example of the style in America. The overall form, with severe rectangular lines and wide tablet, is a distinctive Philadelphia type. However, the painted decoration seems to have no parallel in other Philadelphia furniture, although very closely related painted decoration is documented to Baltimore. Likewise, the design of the en suite card table and pier table does not resemble that of other Philadelphia examples but relates to pieces made in Baltimore. What remains unclear is whether these chairs were made and painted in Philadelphia, made in Philadelphia and decorated in Baltimore, or made completely in Baltimore.",American;American,Benjamin Henry Latrobe;George Bridport,1764,1820,dfb531521ee3
34 1/2 x 39 1/4 x 22 inches,Bureau Table,http://www.mfah.org/site_media/cache/c4/ee/c4eebf8eea5095168a4f23a30aa5190e.jpg,"Mahogany, brass, chestnut, yellow poplar",The Bayou Bend Collection; Gift of Miss Ima Hogg,1770,http://www.mfah.org/art/detail/bureau-table/,"Capital of the Rhode Island colony, Newport was an active center for coastal commerce. Its cabinet industry benefited from the town's shipping interests-her artisans producing furniture for local consumption, as well as export. In time, two families, the Townsends and the Goddards, came to dominate the trade. Displayed in the Drawing Room at Bayou Bend, this splendid bureau table is recognized as one of the most brilliant renditions of the Newport block-front-a design consisting of a recessed center panel flanked by two raised panels topped by gracefully carved shells. It is generally acknowledged as the most original design achievement to emanate from colonial America. This example is believed to have been made for Samuel Vernon, a prominent merchant, and was intended to store jewelry, buckles, combs, and brushes, with the kneehole cupboard housing a wig stand. The museum's table is confidently attributed to John Townsend who, during the course of his lengthy career, signed or labeled more than thirty pieces of furniture, a number far greater than that of any other colonial cabinetmaker. This unparalleled body of documented work makes it possible to identify his cabinetry with a high degree of certainty. As such, Townsend's furniture chronicles the maker's rise to become one of America's premier master craftsmen.",American,John Townsend,1732,1809,b53ceb8e8bc0
6 15/16 x 5 1/16 x 8 inches,Tankard,http://www.mfah.org/site_media/cache/3a/fc/3afceba69cdeaa1482993da351054ad1.jpg,Silver,The Bayou Bend Collection; Gift of Miss Ima Hogg,1695-1711,http://www.mfah.org/art/detail/tankard/,"Silver and gold, of intrinsic and symbolic value, have always been highly esteemed. Because the American colonies lacked patron-aristocrats, the earliest manifestations of style occurred not in painting or sculpture but in the decorative arts. The silversmith, more than any other artisan, was keenly aware of the latest stylistic developments through the English-produced vessels he imported to sell alongside those of his own manufacture. John Coney was the first in this country to have fabricated several forms, including the inkstand, fork, sugar box, chafing dish, monteith, and chocolate pot. He was equally adept as an engraver, executing the copper plates for Massachusetts and New Hampshire paper currency. Coney's known work in the Mannerist and Baroque aesthetics establishes him as the most accomplished and versatile of all colonial silversmiths. This tankard is a consummate American expression of early Baroque silver. The vessel was made for John Foster, a prosperous Boston merchant and prominent official with sophisticated taste and lofty aspirations. In 1692 he erected an extraordinary house that introduced New Englanders to the Italian Renaissance style. Foster's tankard, like his mansion, is one of the most eloquent statements of style in early New England.",American,John Coney,1655,1722,199bfc7faeb7
36 x 47 7/8 inches,"Nighttime, Enigma and Nostalgia",http://www.mfah.org/site_media/cache/5a/7b/5a7b347cb47ec0a74434943ed8c4aa61.jpg,Oil on canvas mounted onto panel,Museum purchase with funds provided by the; Caroline Wiess Law Accessions Endowment Fund,1933-1934,http://www.mfah.org/art/100-highlights/nighttime-enigma-and-nostalgia/,"A somber still-life abstraction, Nighttime, Enigma and Nostalgia has long been recognized as among Arshile Gorky's masterpieces. The juxtaposition of textured and flat surfaces, and matte and glossy passages, imparts a great liveliness to the surface, creating a perfect counterbalance to the dark tones of the painting. The Profanation of the Host This work is the only painting and final piece in a series of more than 40 drawings Gorky produced from 1930 to 1934. The first sketches of the series were based on Paolo Uccello's 15th-century panel Nighttime, Enigma and Nostalgia , echoing its fractured space and exaggerated perspective. As the series progressed, Gorky turned his attention to more concrete details, and in particular he chose to isolate and elaborate upon the biomorphic forms that dominated the left half of his drawings. This shift introduced a new and concentrated note of psychological intensity into Gorky's work. Nighttime, Enigma and Nostalgia u is a summation painting, the definitive statement of all of Gorky's influences and concerns in the early 1930s. Cubism and Surrealism, as well as the artist's wide knowledge of the history of art, are brilliantly assimilated into the work. His masterly handling of the different degrees of black, along with the poetic sobriety of the balanced forms, reflects Gorky's interest in Spanish painting. The evidence of his hard work-scraping down and repainting-abounds in this example, testifying to the importance that Gorky assigned to it. In 1941, when asked to describe the subject of , , Gorky replied: ""Wounded birds, poverty, and one whole week of rain.""","American, born Armenia",Arshile Gorky,1904,1948,1c514a0a044c
