dimensions,title,photo,technique,credittext,artyear,link,artdesc,nationality,artist,artist_birth,artist_death,production_id
Image: 3 9/16 x 4 5/16 inches; Sheet: 3 5/8 x 4 1/2 inches,"Old Glory Goes Up on Mt. Suribachi, Iwo Jima",http://www.mfah.org/site_media/cache/ee/6f/ee6f683085094a34096cf01525d4b3d6.jpg,Gelatin silver print,Gift of the Kevin and Lesley Lilly Family,1945,http://www.mfah.org/art/detail/old-glory-goes-mt-suribachi-iwo-jima/,"uOn February 23, 1945, veteran newspaper journalist Joe Rosenthal captured five United States Marines and one United States Navy Corpsman as they raised the American flag on Iwo Jima island in Japan. His photograph remains one of the best-known images of World War II's Pacific War. As the editors of , wrote, In that moment, Rosenthal's camera recorded the soul of a nation. U.S. Camera Magazine Old Glory Goes Up on Mt. Suribachi, Iwo Jima uAfter hearing that the initial flag raised was going to be replaced with a larger one, Rosenthal chose to follow the second team to the top of Mount Suribachi volcano to cover the event. Using a 4x5 field camera and not entirely ready for the initial jerk of the flagpole upward, he took a frame from his hip, anyway. The shot he thought he had missed became an American icon before he had ever seen the resulting image. Rosenthal's photograph of the flag being raised would soon grace the cover of almost every major newspaper, helping to lift human spirits in a time of war, won the Pulitzer Prize and was immortalized in the Marine Corps War Memorial in Arlington, Virginia. It has been the subject of poems, stamps, tattoos, and a major motion picture; has been reenacted at homecomings; has been re-created in Lego bricks; and has been interpreted as yard art. Few images in the history of photography have enjoyed such a full and varied life. uTo view specific works by Rosenthal in the collection, contact the museum's , for an appointment.",American,Joe Rosenthal,1911,2006,db474b6cbd67
86 x 37 1/4 x 15 3/4 inches,Two Circle Sentinel,http://www.mfah.org/site_media/cache/b4/22/b4225bfb881fad5636670ad8f0d26030.jpg,Stainless steel,Museum purchase with funds provided by the Brown Foundation Accessions Endowment Fund in memory of Alice Pratt Brown,1961,http://www.mfah.org/art/detail/smith-two-circle-sentinel/,"David Smith devoted his career to the exploration of sculptural form through the medium of steel. He admired the material not only for its durability and industrial strength, but also for the beauty of its reflective surface and its responsiveness to burnishing. Two Circle Sentinel exhibits the mastery and delicacy Smith brought to his later steel constructions. The image of the sentinel, or watcher, was a theme that fascinated Smith. He made his first Sentinel sculpture in 1956, and by the end of that decade he had created five works in the first series. In 1961 he produced four additional Sentinel sculptures, all of which are characterized by flat planes of highly burnished stainless steel. With these works Smith stripped away the volumetric qualities of sculpture and instead presented the figure as an aggressively two-dimensional presence in space. The first of the 1961 series, Two Circle Sentinel is the closest to human scale of those four. The open circle can be read as an eye, and the lower disc evokes the curve of a classic hip-shot pose. Additional elements welded to the main body of the figure capture light and shadow.",American,David Smith,1906,1965,1596f73c36e2
14 3/8 x 13 9/16 inches,"Trees, Long Island",http://www.mfah.org/site_media/cache/04/07/0407fa1141f7c1ec8d7a15feed055722.jpg,Carbon print on base of silver paint,Museum purchase with funds provided by the Long Endowment for American Art and the Sarah Campbell Blaffer Foundation,1905,http://www.mfah.org/art/detail/trees-long-island/,"In his early career, Edward Steichen firmly believed that for photography to be recognized as a serious art form, the formal qualities of the image must resemble painting. For this reason, he chose to downplay the recording function of a camera, minimizing the details of the scene in favor of a more painterly style. Here, two black trees frame a luminous chestnut tree covered with flowers that appear as though they are dabs of paint. Trees, Long Island uThe primary impetus of the earliest photography was documenting people, places, and events. Steichen's early work demonstrates a departure, to a type of photography in which the maker's personal, pictorial style is paramount. Created in a Romantic vein, this 1905 photograph of trees is more about light and the mood of the setting than faithful representation, uSteichen was an important figure in American art history not only as a photographer but also as an advocate for American art, discovering and fostering artistic talent. With photographer Alfred Stieglitz, Steichen opened an art gallery in New York City. Little Galleries of the Photo-Secession, more famously known as 291, introduced major European Modernists such as Paul C\xe8zanne, Henri Matisse, and Pablo Picasso to American artists. Steichen's later style evolved from the vaguely defined details and textures of , to exploring modes of Modernism within photography by capturing exacting details, a full range of tonal values, and convincingly solid forms. uTo view specific works by Steichen in the collection, contact the museum's , for an appointment.","American, born Luxembourg",Edward Steichen,1879,1973,e8550167cf43
9 5/8 x 12 11/16 inches,Ceramic and Fruit,http://www.mfah.org/site_media/cache/59/b9/59b9f9730977c2413396df94157692fd.jpg,Platinum print,Museum purchase with funds provided by the Brown Foundation Accessions Endowment Fund,1916,http://www.mfah.org/art/detail/ceramic-and-fruit/,"uA monument to early Modernism, Paul Strand's , demonstrates an abandonment of Pictorialism, characterized by a romantic and painterly style, in favor of carefully rendered Abstraction. Ceramic and Fruit uAfter studying with photographer and social reformer Lewis Hine at the Ethical Culture School in New York, Strand traveled throughout Europe. Upon his return to the United States, Strand compiled a portfolio that garnered the 26-year-old a one-man show with photographer and gallery owner Alfred Stieglitz. Strand's work was of particular and timely interest to Stieglitz, who had been seeking photographic divergence from the then-dominant style, Pictorialism. Stieglitz sought images that could keep pace with the 20th-century experience, and Strand's work fit the bill, In the summer of 1916, Strand produced a series of compositional studies that pushed the medium of photography into artistic terrain that had been considered too complex to master with a camera. Influenced by the work of Paul C\xe9zanne, Pablo Picasso, and other Cubist artists, Strand worked closely with still lifes, removing subjects from their normal surroundings and shaping novel approaches to perspective and composition. Ceramic and Fruit. uTo view specific works by Strand in the collection, contact the museum's , for an appointment. Through confronting issues of space, dimensionality, and perspective, Strand's photographic still lifes, along with modern views of the city by Stieglitz and other photographers, created a brand-new Modernist aesthetic within photography. Strand employed what he called straight photographic methods to clearly see the limitations and at the same time the potential qualities of his medium. This balance became the essence of the 20th-century American Modernist movement. Strand's early still lifes are richly printed and exceptionally rare-he made 14 in total, and only one print of u Strand's innovative approach to still life is an important testament to modern art.",American,Paul Strand,1890,1976,6f9ff52fcfe9
Image/Sheet: 9 7/8 x 6 5/8 inches,"Untitled, from the series The Country Doctor",http://www.mfah.org/site_media/cache/27/7f/277fc20fd383df0ef33ad388880166ae.jpg,Gelatin silver print,"Gift of Mr. and Mrs. B. W. Crain in honor of E. L. Crain, M.D.",1948,http://www.mfah.org/art/detail/untitled-series-country-doctor/,"After W. Eugene Smith recovered from the injuries he sustained while producing powerful World War II reportage in the South Pacific, he rejoined Life magazine, which had been founded in 1936 to publish photo essays taken with a mind-guided camera. With his Country Doctor useries, Smith stretched the dimensions of the photo essay by adding an interpretive dimension to the traditional narrative content. The photographs not only documented what the doctor did, but also explored the emotional dimension of the physician's profession, An advocate for moral responsibility in journalism, Smith sought to awaken the conscience of viewers through his photographs. By carefully selecting his subjects and then spending substantial periods of time with them to get a more intimate perspective on their lives, he created in-depth essays that evoke viewer sympathy. This process revolutionized the new field of photojournalism by expanding the scope of what a photo essay could be. Although Smith created several other seminal essays for Life , he felt that the photo essay should be largely managed by the photographer, a view that created friction with editors who were more text-oriented. He ultimately resigned and worked as an independent artist to further his causes. uTo view specific works by Smith in the collection, contact the museum's , for an appointment.",American,W. Eugene Smith,1918,1978,a3898e1a49f6
23 5/16 x 19 1/4 inches,The Brown Angel,http://www.mfah.org/site_media/cache/55/46/55463a194ed20b476df5ffd936bb683b.jpg,Tempera on gesso panel,"Gift of the Caroline Wiess Law Foundation, with additional funds provided by the African American Art Advisory Association and Exxon/Mobil",1959,http://www.mfah.org/art/detail/brown-angel/,"One of the most prominent and prolific American painters of the 20th century, Jacob Lawrence pioneered a Modernist pictorial style while retaining a personal commitment to the figurative. He launched his painting career in Social Realism, the result of his studies with the Works Progress Administration and the Harlem Art Workshop in the 1930s. In the two decades that followed, Lawrence produced a number of paintings that depict nightlife, of which The Brown Angel is exemplary. Brown v. Board of Education uLawrence renders the interior of a bar with an intense compositional dynamism, bold patches of flattened color, and an overall sense of patterning. But these edgy, splintered forms also point to a larger feeling of social unease. The schematic figures and the fractured bar lend an air of tension and disquiet, one that relays the collective anxiety of the black community on the cusp of the Civil Rights Movement. In this scene, painted after the Supreme Court's 1954 , decision, desegregation and its violent backlash loom overhead, much like the timekeeping brown angel who overlooks all.",American,Jacob Lawrence,1917,2000,b9dd4e944863
28 5/8 x 15 1/2 x 13 1/2 inches,Leda,http://www.mfah.org/site_media/cache/11/7e/117e3d87bbc3ec534d9fabf9e39cdfc0.jpg,Painted steel,Gift of Mr. and Mrs. W. D. Hawkins,1938,http://www.mfah.org/art/detail/leda/,"The title Leda refers to the Greco-Roman myth about a god who takes the form of a swan and then seduces a woman. Here, David Smith offers a witty interpretation of the unlikely act of lovemaking between a bird and a woman. Leda Though Smith was not the first sculptor to use steel, no other artist has devoted his career to the medium with such brilliance and mastery. He learned the technique of welding steel from working in a car factory, and he applied this skill to the art of sculpture, forging his first steel work in 1933. Steel offered unique qualities for Smith, as he explained: What it can do in arriving at form economically, no other material can do. The metal itself possesses little art history. What associations it possesses are of this century: power, structure, movement, progress, suspension, destruction, brutality. is one of Smith's more poetic early steel constructions. The image of the swan is suggested by the graceful arcing neck and wing of the piece, while the theme of rape is conveyed by the diagonal thrust of one element piercing another. Myths and historical associations remained of central importance to Smith throughout his career, and many of his later works incorporate a balance between subject matter and radical abstraction.",American,David Smith,1906,1965,3a171e71ee56
66 x 20 x 33 inches,The Last of the Tribes,http://www.mfah.org/site_media/cache/85/89/85899053548478337b4cf671500a554a.jpg,Marble,Museum purchase with funds providedby; the Agnes Cullen Arnold Endowment Fund,1867-1874,http://www.mfah.org/art/detail/last-tribes/,"According to Hiram Powers, the most celebrated American sculptor of the 19th century, this partially nude marble figure represents a Native American woman who is ""run[ning] in alarm, looking back in terror . . . fleeing before civilization."" The sculpture illustrates the view, popular at the time, of Native Americans as ""noble savages,"" doomed to extinction because their traditional ways were being threatened by the westward expansion of the United States. The Last of the Tribes In , graceful, undulating lines capture all the nuances of the figure's form and demeanor. The subject is dressed in an exquisitely detailed skirt, with diamond patterning throughout and tassels that give the sense of movement as she runs. Part contemplative mood, as suggested in the graceful and noble turn of her head, and part high drama (she flees from cultures in conquest), this sculpture projects a poignant and romantic image of a so-called vanishing culture shortly before the Indian Wars ended native self-autonomy. Of note is that Powers accomplished this effect from his vantage point of Florence, Italy, using an Italian woman as a model and creating a fantastical costume that never existed in any Native American culture (except for the Ohio moccasins she wears that apparently formed a part of Powers's studio collection). This potent combination of fantasy, romance, and morality often permeates art of the Victorian era.",American,Hiram Powers,1805,1873,51e5e5d14c2a
14 13/16 x 24 inches,Magnolias on Gold Velvet Cloth,http://www.mfah.org/site_media/cache/46/14/46149437d0cd6dd2b83b76940c7bae8f.jpg,Oil on canvas,"Museum purchase with funds provided by the; Alice Pratt Brown Museum Fund, and gifts of; Isabel B. Wilson and The Brown Foundation, Inc.",1888-1890,http://www.mfah.org/art/detail/magnolias-gold-velvet-cloth/,"In this acutely observed still life, Martin Johnson Heade depicts five magnolias in various stages of blossom. The golden glow of the background and of the plush velvet sets off the various qualities of the flower: the delicate, smooth petals in creamy white; the rough stems; and the waxy finish of the leaves, one of which has been affected by a fungus. Born in Pennsylvania to a prosperous farming family, Heade spent his early years hunting, fishing, and learning to love nature-a passion that led him to paint in landscape and still life more than other genres. Even in an age of peripatetic artists, he was more widely traveled than most, living variously in Europe and America, and traveling to South America on three occasions. uHeade moved in 1883 to Florida, where flourishing tropical flowers like magnolias both encouraged his interest in natural history and appealed to him artistically. He repeatedly painted magnolias, creating compositions that are infinitely varied and show evidence of various alterations that he made while painting. The subtle shifts within his work as a whole account in part for Heade's appeal to modern sensibilities. Although Heade's work received only limited artistic acclaim during his lifetime, his paintings were ""rediscovered"" in the 1940s, and he has since evolved into an undisputed modern American master.",American,Martin Johnson Heade,1819,1904,246d27f1e195
36 x 30 3/16 inches,Arm Organization,http://www.mfah.org/site_media/cache/ff/88/ff880a8c18c746565559585f649d2321.jpg,Oil on canvas,Museum purchase,1914,http://www.mfah.org/art/detail/arm-organization/,"With his friend Morgan Russell, Stanton Macdonald-Wright developed a style of color abstraction called Synchromy, meaning ""with color."" Informed by color theory, Synchromists explored the relationship of color and shapes. The central motif here may suggest a torso or flexed arm; notice the graceful modulations of form and color surrounding the contorted ""knot"" at the center. Arm Organization At the age of 19, Macdonald-Wright left his home in Southern California for Paris. He remained overseas for six years, enrolling in a succession of art schools and committing himself to studying and assimilating the most advanced art of his time. In 1911 he met Russell, a fellow American, and they pioneered Synchromism as the only avant-garde movement in Europe established by Americans in the years before World War I. The war forced Macdonald-Wright to return to the United States, where he ultimately settled in Southern California and became a tireless advocate of Modernism. Dying Captive Macdonald-Wright was convinced that color and sound were equivalent phenomena and that one could orchestrate the colors of a painting the way a composer arranges notes and chords in music. Here, he uses such ""chords"" of complementary colors as a means of organizing the seemingly abstract composition. Yet, is not entirely abstract, and the potential forms of the curving torso, shoulder, and flexed arm likely derive from Michelangelo's sculpture , which the artist studied at the Mus\xe9e du Louvre in Paris.",American,Stanton Macdonald-wright,1890,1973,411f276236ce
40 x 30 inches,Portrait of John B. Gest,http://www.mfah.org/site_media/cache/1c/d3/1cd3f5602d684e5596aecaf03449f183.jpg,Oil on canvas,Museum purchase with funds provided by; the Agnes Cullen Arnold Endowment Fund,1905,http://www.mfah.org/art/detail/portrait-john-b-gest/,"Thomas Eakins's late portraits, which include this powerful likeness, are among the artist's most poignant works. Here, Eakins focuses upon the two elements of portraiture traditionally deemed most important: heads and hands. The piercing gaze and the taut, sinewy hands of the aging subject carry the emotional weight of the painting and testify to Eakins's life-long commitment to portraying the human condition in all its heroism and frailty. uCommissioned from Eakins by the Fidelity Trust Company for $700, this portrait of Fidelity's president, John B. Gest, has little to do with what one might think of as corporate portraiture: bland, formulaic images of seated, appropriately attired men intended to portray serious-minded, upstanding members of the community. Indeed, Gest performed the role to a T, serving as a trustee of the University of Pennsylvania, the Historical Society of Pennsylvania, and the Presbyterian Hospital in Philadelphia, in addition to fulfilling his duties at the financial company he served. However, by turning Gest's gaze away from the viewer, Eakins turns any possible engagement with the sitter into a study and an observation of the visible effects of old age. This portrait reveals the artist's intense devotion to realism through its truthful accuracy and penetrating portrayal of the subject's character,",American,Thomas C. Eakins,1844,1916,e9e61225b21a
35 x 40 inches,"Sunlight and Shadow, Shinnecock Hills",http://www.mfah.org/site_media/cache/d0/6c/d06c4d2e547f232a28b2746463c3812f.jpg,Oil on canvas,Gift of Mrs. James W. Glanville,1895,http://www.mfah.org/art/detail/sunlight-and-shadow-shinnecock-hills/,"This luminous landscape was inspired by the rather flat and ordinary countryside of Shinnecock, Long Island, where William Merritt Chase taught outdoor painting. Chase's deceptively simple composition testifies to his ability to make the ordinary seem extraordinary. Originally from the Midwest, Chase studied at the National Academy of Design in New York, and then in Europe at the Munich Academy, where artists were encouraged to depict ordinary subject matter, and to handle paint broadly using a limited, dark palette enlivened with small bits of bright color. After further study and travel abroad, Chase returned to New York, where he became a highly visible art figure known for his generosity, eclecticism, and charisma, and for his Impressionist scenes of public parks and his bold portraits. Chase's most consistent and brilliant body of work is the series of Impressionist landscapes he painted from 1891 to 1902, during summers at Shinnecock. This imposing example provides a fresh, seemingly spontaneous interpretation of the movement of clouds and sunlight and their effects on the coastal landscape below. Sandwiched in between the scraggly clumps of dune grass, heather, and sky are pink dunes highlighted by a streak of red, and a sliver of sea dotted with white boats.",American,William Merritt Chase,1849,1916,4982e379ecd4
17 5/8 x 23 5/8 inches,Penn's Treaty with the Indians,http://www.mfah.org/site_media/cache/0a/e0/0ae0a326c11f18e3c361890be33b7939.jpg,Oil on canvas,The Bayou Bend Collection; Gift of Alice C. Simkins in memory of Alice Nicholson Hanszen,1830-1840,http://www.mfah.org/art/detail/penns-treaty-indians/,"According to legend, in 1862 Quaker reformer William Penn met with Native Americans at Shackamaxon in Delaware to exchange gifts for land. Although history shows that Penn did meet with the Lenape Indians, no actual treaty exists. For the Quakers, however, the meeting fulfilled the biblical prophecy of a peaceable kingdom on earth. The theme inspired more than a hundred paintings by Quaker preacher Edward Hicks, who also worked as a sign and coach painter. Using a seemingly unsophisticated style, Hicks concentrated on images that conveyed his Quaker beliefs.",American,Edward Hicks,1780,1849,c3e48f8c9b56
23 1/4 x 13 5/8 x 3/4 inches,Sketch in Iron,http://www.mfah.org/site_media/cache/97/37/97372b66549f98a9bb0c39fc7ecc0e8d.jpg,Iron,Gift of American Decorative Art 1900 Foundation in honor of Dominique and John de Menil,1930s,http://www.mfah.org/art/detail/sketch-iron/,"Trained in Europe as a traditional blacksmith, metalworker Samuel Yellin was credited in 1912 with reviving the craft of wrought iron in America. As a craftsman, Yellin believed in working out his designs in three-dimensional ""sketches"" in iron. These small studies show the blacksmith's process and creativity as ""expressed with the hammer."" uYellin's ironwork was commissioned for the private homes of the Vanderbilts and the DuPonts as well as for public spaces at Harvard University and the National Cathedral in Washington, D.C. This example demonstrates Yellin's extraordinary ability to manipulate metal. The naturalistic tendrils have been hand-pulled, giving the impression that the material is far more pliable than it is in reality.","American, born Poland",Samuel Yellin,1885,1940,a40bf68b93b2
15  x 7  inches,Chalice,http://www.mfah.org/site_media/cache/d7/d2/d7d2a1443463dcda559ce3153f771e7c.jpg,Gold-lustered earthenware,Gift of Garth Clark and Mark Del Vecchio,1984,http://www.mfah.org/art/detail/chalice/,"At age 88, when most artists would be well into retirement, Beatrice Wood embarked on a new body of work aesthetically different from her earlier ceramics. Critically lauded as innovative and expressive, the new work almost eclipsed her past objects. The signature pots from this period are a series of complex, often large-scale chalices. Assembled from thrown and hand-built forms, the chalices are totemic, sculptural compositions that demonstrate true harmony between form and glaze. Wood's interest in ceramics was initially stirred by the purchase of six Dutch lusterware plates in 1933. Eager for a matching teapot, she enrolled in a ceramics class. After establishing her own studio, Wood created forms that were the result of free exploration, with experimental glazes. For the next 40 years, she made thrown and hand-built vessels and figures in a range of colors and textures. At once vivid and subtle, her glazes had depth and tonal richness and seemed to be molded with light. This spectrum was achieved through her all-over, in-glaze luster that, when fired, caused metallic salts to rise to the surface, a complex process almost impossible to control. Wood's metallic sheens were unlike any glaze being used by modern potters.",American,Beatrice Wood,1893,1998,430ec29387a7
14 1/4 x 11 3/4 x 10 1/8 inches,Vessel,http://www.mfah.org/site_media/cache/3c/3a/3c3a9494f3bad5826e7740bae04da9e5.jpg,Porcelain,Gift of Garth Clark and Mark Del Vecchio,1981,http://www.mfah.org/art/detail/devore-vessel/,"uRichard DeVore works in porcelain and stoneware and is known for his organically shaped abstract forms that are at once powerful and fragile. In both form and glaze, his works boldly demonstrate a command of material that has been honed by years of experimentation. Since early in his career, DeVore's palette has consisted of flesh tones, ranging from blush to bone. The surfaces of his vessels often feature a delicate craquelure pattern that is created by painstakingly layering coats of glaze. Because of the varied techniques he uses to administer the glazes, DeVore's pieces unfold in layers as they are continually explored, This vessel's undulating rim and graceful curves are reminiscent of Constantin Brancusi's work as well as the marble sculpture of ancient Italy and Greece. During this early period, DeVore focused on the torso form. The anthropomorphic lines of this vessel clearly delineate the human anatomy and allow for a greater sense of intimacy between the viewer and the vessel.",American,Richard Devore,1933,2006,c52850469492
