image,Date,Geography,Medium,Dimensions,Classification,Credit Line,Who,Description,Provenance,EA_id
http://images.metmuseum.org/CRDImages/ap/web-large/DT56.jpg,1765,,Oil on canvas,36 x 50 1/4 in. (91.4 x 127.6 cm),Paintings,"Gift of Samuel P. Avery, 1897",Matthew Pratt,"The picture depicts a scene in the London studio of Benjamin West, who is generally agreed to be the figure standing at the left. Based on comparisons to self-portraits, Pratt is the man at the easel, an accomplished portrait painter. The identities of the other artists represented in the picture remain uncertain, but they are younger and they draw rather than paint. The composition explores the academic tradition as carried out among Americans in late-eighteenth century London.","the artist's son, Nathan Pratt, Philadelphia (until 1805); the artist's great-granddaughter, Rosalie V. Tiers Jackson, Philadelphia (by 1887); Samuel Putnam Avery Sr., New York (by 1896-97)",3e43e9cfd025
http://images.metmuseum.org/CRDImages/ap/web-large/DP227346.jpg,"1895, revised 1909, cast by November 1910",,Bronze,32 1/4 x 27 1/4 x 15 in. (81.9 x 69.2 x 38.1 cm),Sculpture,"Bequest of Jacob Ruppert, 1939",Frederic Remington,,"Jacob Ruppert Jr., died 1939",24dd313efff9
http://images.metmuseum.org/CRDImages/ap/web-large/DT2570.jpg,"1892-1903; this cast, 1914 or after (by 1916)",,"Bronze, gilt","38 x 9 1/2 x 18 1/2 in., 203lb. (96.5 x 24.1 x 47 cm)",Sculpture,"Rogers Fund, 1917",Augustus Saint-Gaudens,"This sculpture is a reduction of the Victory that is part of the Sherman Monument (1903; New York, Grand Army Plaza). The famed equestrian statue, dedicated to the Civil War hero William Tecumseh Sherman (1820-1891), is one of Manhattan's finest public sculptures, and a noble heir to the equestrian tradition begun in ancient Rome and continued through the Renaissance. Saint-Gaudens' ""Victory"" has traditional attributes—a laurel crown and a palm leaf—and is depicted by Saint-Gaudens as a guiding force. Her outstretched right arm leads the obediant horse, upon which sits a battle-hardened General Sherman. Saint-Gaudens painstakingly arranged drapery on numerous nude models for ""Victory"" before settling on what he believed was the perfect flow of her robe. Letters written by Saint-Gaudens near the completion of the monument reveal his triumphant feelings about the monument, and the figure of ""Victory."" In a letter to his niece, Rose S. Nichols, he wrote, ""It's the greatest 'Victory' anybody ever made. Hooraah!""",,ad5e1ae19401
http://images.metmuseum.org/CRDImages/ap/web-large/DT91.jpg,1883-84,,Oil on canvas,82 1/8 x 43 1/4 in. (208.6 x 109.9 cm),Paintings,"Arthur Hoppock Hearn Fund, 1916",John Singer Sargent,"Madame Pierre Gautreau (the Louisiana-born Virginie Amélie Avegno; 1859-1915) was known in Paris for her artful appearance. Sargent hoped to enhance his reputation by painting and exhibiting her portrait. Working without a commission but with his sitter’s complicity, he emphasized her daring personal style, showing the right strap of her gown slipping from her shoulder. At the Salon of 1884, the portrait received more ridicule than praise. Sargent repainted the shoulder strap and kept the work for over thirty years. When, eventually, he sold it to the Metropolitan, he commented, “I suppose it is the best thing I have done,?but asked that the Museum disguise the sitter’s name.","The artist, 1884-1916",52906338b4ad
http://images.metmuseum.org/CRDImages/ap/web-large/DT2573.jpg,"1863, cast 1891",,Bronze,19 1/2 x 14 3/4 x 9 3/4 in. (49.5 x 37.5 x 24.8 cm),Sculpture,"Gift of Charles Anthony Lamb and Barea Lamb Seeley, in memory of their grandfather, Charles Rollinson Lamb, 1979",John Quincy Adams Ward,"Ward probably began ""The Freedman"" following Abraham Lincoln's Emancipation Proclamation, issued on September 22, 1862. The sculptor exhibited a model to acclaim in the annual exhibition of the National Academy of Design in spring 1863. Contemporary appreciation for the statuette arose from a desire for art that addressed current issues rather than less tangible themes unrelated to American life. Not only does ""The Freedman"" comment on the chief political, social, and moral topic of the era, but it also proclaims Ward's abolitionist sentiments. The seminude man sits on a tree stump, the manacle on his left wrist and the chain in his right hand potent reminders of his former servitude. Enhancing the statuette's powerful theme is Ward's commitment to realism. The fidelity to physiognomy and anatomical accuracy of the twisting body reveal an unprecedented naturalism in nineteenth-century American sculpture.","Charles Rollinson Lamb, died 1942; the Lamb family, until 1979",29bf1f0abe3b
http://images.metmuseum.org/CRDImages/ap/web-large/DT202891.jpg,1895,,Oil on canvas,24 1/4 x 33 3/4 in. (61.6 x 85.7 cm),Paintings,"Gift of Mrs. John A. Rutherfurd, 1914",Julian Alden Weir,,"the artist, at least until 1910; Mrs. John A. Rutherfurd, New York, by 1910-1914",cb24ca1faefd
http://images.metmuseum.org/CRDImages/ap/web-large/DT2780.jpg,ca. 1870-80,,Oil on canvas,27 x 53 1/8 in. (68.6 x 134.9 cm),Paintings,"John Stewart Kennedy Fund, 1912",James McNeill Whistler,,"Thomas Way, London, by 1879 (purchased from auctioneers before the sale of Whistler's White House, 1879); his son, Thomas R. Way, London, until at least 1905; Alexander Arnold Hannay, London, after 1905-at least 1910; with Percy M. Turner, London, 1912",67b7f41181ee
http://images.metmuseum.org/CRDImages/ap/web-large/DP105577.jpg,ca. 1810,,Watercolor on ivory,4 x 3 in. (10.2 x 7.6 cm),Paintings,"Gift of Mrs. John R. Wadleigh, 1993",Joseph Wood,,"in the artist's family; the artist's daughter, Maria Ray; the artist's great granddaughter, Helen Baily Chandler; her niece, Mrs. John R. Wadleigh, until 1993",bd0004599236
http://images.metmuseum.org/CRDImages/ap/web-large/DT9348.jpg,ca. 1905,,Oil on canvas,25 x 30 in. (63.5 x 76.2 cm),Paintings,"George A. Hearn Fund, 1921",William James Glackens,,,c94d9eb13863
http://images.metmuseum.org/CRDImages/ap/web-large/DP227273.jpg,"1918, cast by 1919",,Copper alloy (Bronze),33 x 26 x 8 3/4 in. (83.8 x 66 x 22.2 cm),Sculpture,"Purchase, Friends of the American Wing Fund, Mr. and Mrs. S. Parker Gilbert Gift, Morris K. Jesup and 2004 Benefit Funds, 2010",James Earle Fraser,,"F. E. Drake, Cleveland, Ohio, by 1919; Kennedy Galleries, New York; private collection, Wichita, Kansas, until 2004; Gerald and Kathleen Peters, Jackson Hole, Wyoming, 2004-9; Gerald Peters Gallery, New York, 2009-present.",6fc0bc147dbe
