image,Date,Geography,Medium,Dimensions,Classification,Credit Line,Who,Description,Provenance,EA_id
http://images.metmuseum.org/CRDImages/ad/web-large/DP228047.jpg,1770-76,"Mid-Atlantic, New York City, New York, United States",Silver,11 3/16 x 14 7/16 x 11 3/8 in. (28.4 x 36.7 x 28.9 cm); 41 oz. 5 dwt. (1282.7 g),Silver,"Morris K. Jesup Fund, 1954",Myer Myers,"American baskets for bread, cake, or fruit are extremely rare. The monogram on the interior is for Susannah and Samuel Cornell. Myers made several objects for these wealthy patrons from New York and New Bern, North Carolina. According to the inscription on the underside of the basket, the Cornells later gave it to their daughter Hannah, who married Herman LeRoy on October 19, 1786.","Made for Samuel (1731-1781) and Susannah Mabson (d. 1778) Cornell, New York, NY and New Bern, NC; to their daughter, Hannah Cornell Le Roy (ca. 1760-1818); by descent to Stuyvesant Le Roy (b. 1865); to his cousin, Augusta McCagg (b. 1895)I; bought by The Metropolitan Museum of Art, 1954.",08afa22e620f
http://images.metmuseum.org/CRDImages/ad/web-large/DP104414.jpg,1700-1710,"Mid-Atlantic, New York City, New York, United States",Silver,Overall 5 3/8 x 13 13/16 in. (13.7 x 35.1 cm); 25 oz. 19 dwt. (806.9 g); Lip Diam. 9 11/16 in. (24.6 cm); Foot Diam. 4 13/16 in. (12.2 cm),Silver,"Samuel D. Lee Fund, 1938",Cornelius Kierstede,"Derived from Dutch, Scandinavian, and English sources, brandywine bowls were used on festive occasions such as the kindermaal, when women gathered to welcome a newborn child. Following Dutch custom, a bowl would be filled with raisins and brandy and passed from guest to guest. Here, boldly chased tulips create a sumptuous effect. The bowl belonged to Theunis Jacobsen Quick, a wealthy baker, and his wife, Vroutje 4516 Janse Haring.","Theunis Jacobsen Quick and Vroutje Janse Haring; with Robert Ensko, New York; sold to The Metropolitan Museum of Art, 1938.",6e2b5f8bee34
http://images.metmuseum.org/CRDImages/ad/web-large/DP108633.jpg,1758,"New England, Newport, Rhode Island, United States","Walnut, maple",46 3/8 x 32 3/8 x 25 7/8 in. (117.8 x 82.2 x 65.7 cm),Furniture,"Gift of Mrs. J. Insley Blair, 1950",Caleb Gardner,"Eighteenth-century easy chairs heavily padded, with thick down-filled cushions, and with wings to rest one's head against and keep drafts away—were often reserved for the elderly or the infirm. This New England example is remarkable for its elaborate upholstery and intact condition. The front is covered with Irish stitch needlework and the back with a needlework landscape scene. The seams are covered with silk tape. The frame is inscribed by ""Gardner Junr,"" presumably the upholsterer, and dated ""Newport, May 1758.""","The Keech or Keach family, Newport, Rhode Island, by 1850-1926; with Ginsburg and Levy Inc., New York, 1926; Mrs. J. Insley Blair, Tuxedo Park, New York, 1926-1950",2e988ead147f
http://images.metmuseum.org/CRDImages/ad/web-large/DT2511.jpg,1765-69,"Mid-Atlantic, Albany, New York, United States","Wood, paper, and paint",Dimensions unavailable,Architecture,"Gift of Mrs. William Bayard Van Rensselaer, in memory of her husband, 1928",,,"Stephen Van Rensselaer II, Albany, New York, 1769; Mrs. William Bayard Van Rensselaer, Albany, New York, until 1928",e5fbadec3457
http://images.metmuseum.org/CRDImages/ad/web-large/DP116692.jpg,ca. 1772,"New England, Newport, Rhode Island, United States","Mahogany, chestnut, tulip poplar",86 3/4 x 44 x 21 3/8 in. (220.3 x 111.8 x 54.3 cm),Furniture,"Purchase, Friends of the American Wing Fund, Mr. and Mrs. Robert G. Goelet Gift, Sansbury-Mills Fund, and Leigh Keno and The Hohmann Foundation Gifts, 2005",Thomas Townsend,,"Presumably David Gardiner (1738-1774), Gardiner's Island; to John Lyon Gardiner, and thence in direct descent to Robert D.L. Gardiner, from whose estate it was sold in January 2005. The recently discovered ""Nicholas Easton 1772"" inscription offers exciting opportunities for further research. The date is absolutely appropriate for the manufacture of the piece. Nicholas Easton (1733-1811), descended from one of the founders of Newport, is said to have been a cabinetmaker, but as yet we know very little about him.",bb900122ebf3
http://images.metmuseum.org/CRDImages/ap/web-large/DT1551.jpg,1895,,Oil on canvas,52 1/4 x 63 5/8 in. (132.7 x 161.6 cm),Paintings,"Anonymous Gift, 1980",John White Alexander,,"the artist, until died 1915; his wife, Elizabeth A. Alexander, New York and Princeton, New Jersey, 1915-died 1947; her son, James W. Alexander, Princeton, New Jersey, 1947-died 1971; his daughter, Irina A. Reed, New York, 1971-1979",0d2b0c37d96c
http://images.metmuseum.org/CRDImages/ap/web-large/DT82.jpg,1863,,Oil on canvas,73 1/2 x 120 3/4 in. (186.7 x 306.7 cm),Paintings,"Rogers Fund, 1907",Albert Bierstadt,"This painting is the major work that resulted from the artist's first trip to the West. His intention to create panoramic views of the American frontier was apparent by December 1858, just before he embarked on the trip. In early 1859 he accompanied a government survey expedition, headed by Frederick W. Lander, to the Nebraska Territory. By summer, the party had reached the Wind River Range of the Rocky Mountains in what is now Wyoming. Bierstadt dubbed the central mountain in the picture Lander's Peak following the colonel's death in the Civil War. This was one of a number of large works painted after Bierstadt's return from these travels. It was completed in 1863, exhibited to great acclaim, and purchased in 1865 for the then-astounding sum of $25,000 by James McHenry, an American living in London. Bierstadt later bought it back and gave or sold it to his brother Edward.","With Emil Seitz, Seitz and Noelle Gallery, New York, by 1864; James McHenry, London, 1866-98; the artist's brother, Edward Bierstadt, 1898-died 1907; his daughter, Mary Adeline Bierstadt, 1907",8a494b57653e
http://images.metmuseum.org/CRDImages/ap/web-large/DT73.jpg,1845,,Oil on canvas,29 x 36 1/2 in. (73.7 x 92.7 cm),Paintings,"Morris K. Jesup Fund, 1933",George Caleb Bingham,"On June 4, 1845, Bingham returned from a winter stay in central Missouri to St. Louis, bringing with him several paintings and many sketches. This apparently was one of the pictures that he brought with him, and he sent it later that year for sale to the American Art-Union. It was first called ""French-Trader—Half breed Son,"" but the Art-Union gave it the title by which it is now known. Bingham, whose earliest efforts were portraits, produced a masterpiece of genre painting with little precedent in his oeuvre. The strikingly spare, geometric composition and luminist light recall the paintings of William Sidney Mount, particularly his ""Eel Spearing at Setauket"" (New York State Historical Association, Cooperstown). The solemn, motionless scene immortalizes the vanished world of the American frontier, constructed for a northeastern audience. The tranquil work was submitted to the Art-Union as a possible companion to the more implicitly violent ""The Concealed Enemy"" (Stark Museum of Art, Orange, Texas), in which an armed Osage warrior lies in wait behind a boulder. The polar opposition of quietude, savagery, and frontier danger embodied in the paintings held enormous appeal for urban viewers. Bingham painted a similar, though less extraordinary, picture called ""The Trapper's Return"" (Detroit Institute of Arts) in New York in 1851.","American Art-Union, New York, 1845; by lottery to Robert S. Bunker, Mobile, Alabama; his daughter, Josephine (Mrs. Alphonse) du Mont; her daughter, Lina du Mont, Point Clear, Alabama; with E. Herndon Smith, New York, as agent, 1932; with John Wise Ltd, New York, 1933",52360a9b6d1a
http://images.metmuseum.org/CRDImages/ap/web-large/DT95.jpg,ca. 1892,,Oil on canvas,20 x 34 in. (50.8 x 86.4 cm),Paintings,"Bequest of Miss Adelaide Milton de Groot (1876-1967), 1967",William Merritt Chase,"Beginning in 1891 Chase taught at a summer art school in Shinnecock, Long Island. The following year, he and his family moved into their new summer home, Shinnecock Hall, which had been designed and built by the well-known firm of McKim, Mead and White. Chase taught at the beach resort until 1902, conducting open-air classes for as many as a hundred students each summer. This work is characteristic of the outdoor scenes that Chase painted during the 1890s on Long Island beaches.","Laird collection, Philadelphia, until 1943; sale, Samuel T. Freeman and Company, Philadelphia, April 19, 1943, no. 26; with Mr. Michelotti, New York, 1943; with M. Knoedler and Company, New York, 1943; with Grand Central Art Galleries, New York, 1943; Adelaide Milton de Groot, New York, 1943-died 1967",2f1e8589e657
http://images.metmuseum.org/CRDImages/ap/web-large/DT78.jpg,1859,,Oil on canvas,66 1/8 x 119 1/4in. (168 x 302.9cm),Paintings,"Bequest of Margaret E. Dows, 1909",Frederic Edwin Church,"This picture was inspired by Church's second trip to South America in the spring of 1857. Church sketched prolifically throughout his nine weeks travel in Ecuador, and many extant watercolors and drawings contain elements found in this work. The picture was publicly unveiled in New York at Lyrique Hall, 756 Broadway, on April 27, 1859. Subsequently moved to the gallery of the Tenth Street Studio Building, it was lit by gas jets concealed behind silver reflectors in a darkened chamber. The work caused a sensation, and twelve to thirteen thousand people paid twenty-five cents apiece to file by it each month. The picture was also shown in London, where it was greatly admired as well.","William T. Blodgett, New York, 1859-76; sale, Chickering Hall, New York, April 27, 1876, no. 92 [bought before the auction by David Dows]; David Dows, New York, 1876-died 1890; his wife, Mrs. David (Margaret E.) Dows, New York, 1890-died 1909",5369baf337cd
http://images.metmuseum.org/CRDImages/ap/web-large/DT71.jpg,1836,,Oil on canvas,51 1/2 x 76 in. (130.8 x 193 cm),Paintings,"Gift of Mrs. Russell Sage, 1908",Thomas Cole,"Long known as ""The Oxbow,"" this work is a masterpiece of American landscape painting, laden with possible interpretations. In the midst of painting ""The Course of Empire"" (New-York Historical Society), Cole mentioned in a letter dated March 2, 1836, to his patron Luman Reed that he was executing a large version of this subject expressly for exhibition and sale. The picture was shown at the National Academy of Design in 1836 as ""View from Mount Holyoke, Northampton, Massachusetts, after a Thunderstorm."" Cole's interest in the subject probably dates from his 1829-32 trip to Europe, during which he made an exact tracing of the view published in Basil Hall's ""Forty Etchings Made with the Camera Lucida in North America in 1827 and 1828."" Hall criticized Americans' inattentiveness to their scenery, and Cole responded with a landscape that lauds the uniqueness of America by encompassing ""a union of the picturesque, the sublime, and the magnificent."" Although often ambiguous about the subjugation of the land, here the artist juxtaposes untamed wilderness and pastoral settlement to emphasize the possibilities of the national landscape, pointing to the future prospect of the American nation. Cole's unequivocal construction and composition of the scene, charged with moral significance, is reinforced by his depiction of himself in the middle distance, perched on a promontory painting the Oxbow. He is an American producing American art, in communion with American scenery. There are both sketchbook drawings with annotations and related oil sketches of this subject. Many other artists copied or imitated the painting.","Charles N. Talbot, New York, by June 1838-died 1874; his estate; Mrs. Russell Sage, New York, until 1908",84ba3437b452
http://images.metmuseum.org/CRDImages/ap/web-large/DT58.jpg,1771,,Oil on canvas,49 1/2 x 40 in. (125.7 x 101.6 cm),Paintings,"Gift of Bayard Verplanck, 1949",John Singleton Copley,"Daniel Crommelin Verplanck (1762-1834) was born in New York and spent the early part of his life in the family home on lower Wall Street. He was the eldest son of Judith Crommelin and Samuel Verplanck (39.173). While attending Columbia College (formerly King's College), he married Elizabeth Johnson, daughter of the president of Columbia. They had two children. Following her death in 1789, Verplanck married Ann Walton, with whom he had seven children. They lived on Wall Street until 1803 and then moved to Fishkill-on-Hudson, New York. He represented Dutchess County in Congress from 1803 until 1809. The portrait was painted in 1771 when Daniel was nine years old. The background has traditionally been identified as a view from the Verplanck country house at Fishkill, looking toward Mount Gulian.","The subject's son, Gulian Crommelin Verplanck, Fishkill, New York, 1834-died 1870; W. E. Verplanck, Fishkill, by 1892-1935?; W. Everett Verplanck, Salem, Massachusetts, by 1938-49; with M. Knoedler and Company, New York, 1949; Bayard Verplanck, Fishkill-on-Hudson, New York, 1949",a39b65e1b7d4
http://images.metmuseum.org/CRDImages/ap/web-large/DT2583.jpg,"1887, replica 1908",,Oil on canvas,33 1/2 x 47 1/8 in. (85.1 x 119.7 cm),Paintings,"Gift of friends of the artist, through August F. Jaccaci, 1908",Kenyon Cox,,,c4cf9a7de849
http://images.metmuseum.org/CRDImages/ap/web-large/DT86.jpg,1871,,Oil on canvas,32 1/4 x 46 1/4 in. (81.9 x 117.5 cm),Paintings,"Purchase, The Alfred N. Punnett Endowment Fund and George D. Pratt Gift, 1934",Thomas Eakins,"Returning to Philadelphia from Europe in 1870, Eakins began a series of representations of the sport of sculling, a subject with which he is uniquely identified. This, the first major work in the series, probably commemorates the victory of Max Schmitt (1843-1900), an attorney and skilled amateur rower, in an important race held on the Schuylkill River in October 1870. Also an avid rower, Eakins depicted himself pulling the oars of a scull in the middle distance. Eakins constructed the painting according to the academic principles espoused by his primary Parisian teacher, Jean-Léon Gérôme.","Max Schmitt, Philadelphia; his wife, Mrs. Louise S. M. Nache, until 1930; Mrs. Thomas Eakins, Philadelphia, 1930-33; with Babcock Galleries, New York, 1930-31; with Milch Galleries, New York, 1934",ac56df66cba8
http://images.metmuseum.org/CRDImages/ap/web-large/DT60.jpg,1789,,Oil on canvas,83 x 51 in. (210.8 x 129.5 cm),Paintings,"Bequest of Susan W. Tyler, 1979",Ralph Earl,"Earl portrayed the richly dressed dry goods merchant Elijah Boardman (1760-1823) in his store in New Milford, Connecticut. His right hand rests on a counting desk protected and decorated by green cloth secured with brass nails. The shelves of the desk house books, including Moore's ""Travels,"" Shakespeare's plays, Milton's ""Paradise Lost,"" Johnson's dictionary, and the ""London Magazine"" for 1786. Through the open paneled door to the right of the subject, bolts of plain and patterned textiles, including one with a prominently displayed British tax stamp, invite inspection and tell the viewer how Boardman earned a living, just as the books in his desk and the letter in his hand speak of his learning and awareness of culture. Earl also painted Esther Boardman, sister to Elijah (1991.338).","By descent, Cornelius Boardman Tyler, Plainfield, New Jersey, died 1955; Mrs. Cornelius Boardman (Susan W.) Tyler, Fairfield, New Jersey, died 1979",193081fb118b
http://images.metmuseum.org/CRDImages/ap/web-large/DT81.jpg,1862,,Oil on canvas,48 x 39 7/8 in. (121.9 x 101.3 cm),Paintings,"Bequest of Maria DeWitt Jesup, from the collection of her husband, Morris K. Jesup, 1914",Sanford Robinson Gifford,"From 1845 until his death in 1880, Gifford chose Kauterskill Clove in the Catskill Mountains as one of his favorite subjects. This painting, dated 1862, was called ""Kauterskill Falls"" in the catalogue of the 1876 New York Centennial Loan Exhibition of Paintings, as well as in the 1881 official catalogue of Gifford's work. The title has since been changed to ""Kauterskill Clove,"" for the view is from the east, looking west to Haine's Falls at the head of the clove.","Morris K. Jesup, New York, by 1876-died 1908; his wife, Maria DeWitt Jesup, New York, 1908-died 1914",62f0b39fe0d6
http://images.metmuseum.org/CRDImages/ap/web-large/DT79.jpg,1859,,Oil on canvas,28 x 44 in. (71.1 x 111.8 cm),Paintings,"Gift of Erving Wolf Foundation and Mr. and Mrs. Erving Wolf, in memory of Diane R. Wolf, 1975",Martin Johnson Heade,"Heade became a good friend of the acclaimed landscape painter Frederic Church (1826-1900), but he worked on the periphery of the Hudson River School. He specialized not in dramatic wilderness subjects, as many of the school did, but preferred more prosaic marshlands and coastal settings. Even when he painted storms, as here, he portrayed not the actual tempest, but its tense preamble of blackening sky and eerily illumined terrain. This painting was based on a sketch of an approaching storm that Heade witnessed on Rhode Island's Narragansett Bay about 1858. The image became the basis for a more elaborate and synthetic version of the subject painted in 1868 (Amon Carter Museum, Fort Worth, Texas).","William H. Chapman, New York, and East Orange, New Jersey, until died 1891; his wife, Helen Chapman, Oakland, Florida, and Bethlehem, Pennsylvania, 1891-1905; his son, Niles Chapman, Indianapolis, 1905-44; descended in the family of Helen W. Fleischer, 1944-69; Thomas Fleischer, Bethlehem, Pennsylvania, 1969-73; his son, David N. Fleischer, Bethlehem 1973-75; the Erving Wolf Foundation and Mr. and Mrs. Erving Wolf, New York, 1975 (Mr. and Mrs. Wolf retained one-third interest until 1977)",d3cad4d6c46d
http://images.metmuseum.org/CRDImages/ap/web-large/DP140858.jpg,1899,,Oil on canvas,28 1/8 x 49 1/8 in. (71.4 x 124.8 cm),Paintings,"Catharine Lorillard Wolfe Collection, Wolfe Fund, 1906",Winslow Homer,"""The Gulf Stream"" was based upon studies made during Homer's two winter trips to the Bahamas in 1884-85 and 1898-99. First exhibited at the Pennsylvania Academy of the Fine Arts in Philadelphia in 1900, the picture was subsequently reworked and ""improved"" by the artist. Early photographs show changes to the sea and to the back of the ship, making the composition more dramatic and vivid. The painting was shown in this state at the Carnegie Institute in Pittsburgh in 1900-01, and then at M. Knoedler and Co. in New York, where the artist placed on the picture the record-asking price of $4,000. There were problems selling the work because of either its high price or its unpleasant subject matter. Homer may have reworked the painting again in the face of this criticism in order to add the rigger on the horizon that signals hope and rescue from the perils of the sea.","the artist (1899-1906); M. Knoedler and Company, New York (1906)",e836febbb1ee
http://images.metmuseum.org/CRDImages/ap/web-large/DT83.jpg,1866,,Oil on canvas,24 x 38 in. (61 x 96.5 cm),Paintings,"Gift of Mrs. Frank B. Porter, 1922",Winslow Homer,"The material that Homer collected as an artist-correspondent during the Civil War provided the subjects for his first oil paintings. In 1866, one year after the war ended and four years after he reputedly began to paint in oil, Homer completed this picture, a work that established his reputation. It represents an actual scene from the war in which a Union officer, Brigadier General Francis Channing Barlow (1834-1896) captured several Confederate officers on June 21, 1864. The background depicts the battlefield at Petersburg, Virginia. Infrared photography and numerous studies indicate that the painting underwent many changes in the course of completion.","With Samuel Putnam Avery, New York, 1866; John Taylor Johnston, New York, 1866-76; sale, Somerville Art Gallery, New York, December 20, 1876, no. 181; Robert Lenox Kennedy, New York, 1876-died 1887; his sister, Mary Lenox Kennedy, New York, 1887-died 1917; her great-grandniece, Rachel Lenox Kennedy (Mrs. Frank B.) Porter, New York, until 1922",fdcced306cf3
http://images.metmuseum.org/CRDImages/ap/web-large/DT85.jpg,1870-71,,Oil on canvas,48 x 73 3/8 in. (121.9 x 186.4 cm),Paintings,"Gift of Frederic H. Hatch, 1926",Eastman Johnson,"Alfrederick Smith Hatch (1829-1904) was a prominent Wall Street broker in the firm of Fisk and Hatch and president of the New York Stock Exchange from 1883 to 1884. Like many of his business associates, he was an enthusiastic collector of art. One of the finest paintings in his collection was this commissioned group portrait showing three generations of his family. It depicts them in the library of their New York residence at 49 Park Avenue, on the northeast corner of 39th Street. Hatch is seated to the right at his desk, and his wife, the former Theodosia Ruggles (1829-1908), leans on the mantel. Other members of the family, including Theodosia's mother, Hatch's father, and their children are also present.","Alfrederick Smith Hatch, New York, 1871-died 1904; his son, Frederic H. Hatch, New York, by 1926",0a95e8a70a09
http://images.metmuseum.org/CRDImages/ap/web-large/DP215410.jpg,1851,,Oil on canvas,149 x 255 in. (378.5 x 647.7 cm),Paintings,"Gift of John Stewart Kennedy, 1897",Emanuel Leutze,"Leutze's depiction of Washington's attack on the Hessians at Trenton on December 25, 1776, was a great success in America and in Germany. Leutze began his first version of this subject in 1849. It was damaged in his studio by fire in 1850 and, although restored and acquired by the Bremen Kunsthalle, was again destroyed in a bombing raid in 1942. In 1850, Leutze began this version of the subject, which was placed on exhibition in New York during October of 1851. At this showing Marshall O. Roberts bought the canvas for the then-enormous sum of $10,000. In 1853, M. Knoedler published an engraving of it. Many studies for the painting exist, as do copies by other artists.","With Goupil, Vibert and Company, Paris and New York, 1851-52; Marshall O. Roberts, New York, 1852-died 1880; his estate, 1880-97; sale, Ortgies and Company, Fifth Avenue Art Galleries, New York, January 20, 1897, no. 172; John S. Kennedy, New York, 1897",31e44da46c06
http://images.metmuseum.org/CRDImages/ap/web-large/DT69.jpg,ca. 1836-37,,Oil on canvas,73 3/4 x 57 5/8 in. (187.3 x 146.4 cm),Paintings,"Bequest of Herbert L. Pratt, 1945",Samuel F. . Morse,"The full-length portrait of Susan Walker Morse (1819-1885), the eldest daughter of the artist, was painted during the crucial years of the invention of Morse's telegraph (ca. 1835-37). The painting shows the girl at about the age of seventeen, sitting with a sketchbook in her lap and pencil in hand with her eyes raised in contemplation. Although traditionally described as a Muse, the figure is more likely a personification of the art of drawing or design. Morse drew on the full extent of his European training, taking from the works of Rubens and Veronese in what was to be an ambitious farewell to his career as an artist. Stymied by a lack of financial success, he abandoned painting for science and inventing. This painting was first exhibited at the National Academy of Design in 1837, where it won enthusiastic praise. Susan married Edward Lind in 1839 and moved to his sugar plantation in Puerto Rico, returning often to New York to spend extended periods with her father, who had been left a widower when Susan was just six. She gradually grew less and less happy with her husband and plantation life. Lind died in 1882; in 1885, Susan set out to return to New York permanently but tragically was lost at sea.","The artist, New York, 1837-died 1872; his second wife, Mrs. Samuel F. B. (Sarah Griswold) Morse, Poughkeepsie, New York, died 1902; his granddaughter, Susan Lind Morse (Mrs. George Kellogg) Perry, died 1910; George K. Perry, 1910-ca. 1917; Herbert Lee Pratt, Glen Cove, New York, ca. 1917-45",03fe2901add4
http://images.metmuseum.org/CRDImages/ap/web-large/DP167126.jpg,ca. 1779-81,,Oil on canvas,95 x 61 3/4 in. (241.3 x 156.8 cm),Paintings,"Gift of Collis P. Huntington, 1897",Charles Willson Peale,"On January 18, 1779, the Supreme Executive Council of Pennsylvania passed a resolution commissioning a portrait of George Washington for the Council Chamber and selected Charles Willson Peale as the artist. In preparation, Peale traveled to the Princeton and Trenton battlefields in February of 1779 to make sketches for the background. The original portrait, the full-length version now in the Pennsylvania Academy of Fine Arts, was a tremendous success and Peale completed numerous copies for royal palaces abroad, each time updating the general's military dress. This figure of George Washington was probably painted between June and August of 1780. In every other version, Washington is shown after the Battle of Princeton, but here he is depicted after the Battle of Trenton, the turning point of the war. It has been suggested that this portrait was commissioned upon the order of Mrs. Washington, because it is the only portrait in which Washington wears his state sword and because the painting descended in the Washington family.","The sitter's niece, Harriet (Mrs. Andrew Parks), until 1822; her daughter, Mary Parks (Mrs. Milton Hanford); her cousin, Miss Bell, Tooting, Surrey, England; with Samuel Putnam Avery, Jr., New York, 1896; Collis P. Huntington, New York, 1896-97",e9b19c4474d3
http://images.metmuseum.org/CRDImages/ap/web-large/DT2063.jpg,1835-40,,Oil on canvas,37 7/8 x 34 1/4 in. (96.2 x 87 cm),Paintings,"Gift of Edgar William and Bernice Chrysler Garbisch, 1962",Ammi Phillips,,"Massachusetts art market, 1959; Edgar William and Bernice Chrysler Garbisch, Cambridge, Maryland, 1959-1962",56e686dc72b5
