Artist_Name,birth_date,death_date,Production_Year,Title,Artwork_Details,Image_URL,EA_id
Ben Abril,1923,1995,1966,The Old Hall of Records,Painting Oil on canvas 48 3/16 x 60 1/16 in. 122.4 x 152.56 cm Signed lower right: BEN ABRIL. Inscribed and dated lower left: OLD HALL OF RECORDS / LOS ANGELES CALIF. 1966 Museum Associates Acquisition Fund,http://collectionsonline.lacma.org/MWEBimages/aa_mm/full/M67_89.jpg,bc48a6366cb3
Wayman Adams,1883,1959,1924,Portrait of William Preston Harrison,Painting Oil on canvas 52 1/16 x 40 1/16 in. 132.24 x 101.76 cm Mr. and Mrs. William Preston Harrison Collection,http://collectionsonline.lacma.org/MWEBimages/all%20departments/thumb/25_6_2.jpg,23610feb3574
John White Alexander,1856,1915,1902,Portrait of Mrs. John White Alexander,Painting Oil on canvas 62 1/4 x 52 1/8 in. 158.2 x 132.4 cm Gift of Dr. and Mrs. Matthew S. Mickiewicz,http://collectionsonline.lacma.org/MWEBimages/aa_mm/full/M81_182.jpg,e9872cfa5252
Mabel Alvarez,1891,1985,1934,Arabella with Calla Lillies,Painting Oil on canvas 40 x 30 in. 101.6 x 76.2 cm Gift of Margery and Maurice H. Katz,http://collectionsonline.lacma.org/MWEBimages/aa_mm/full/M91_326.jpg,f2c0a12536cc
Robert Witt Ames,1896,1985,1935,Hollywood,Sculpture: Mahogany bas relief carving Framed: 61 x 87 1/4 x 2 in. 154.9 x 221.6 x 5.1 cm Gift from the Estate of Barbara Carol Weston sister of Robert Witt Ames,http://collectionsonline.lacma.org/MWEBimages/all%20departments/thumb/M2002_85.jpg,ad9d7986fa1e
Toshio Aoki,1854,1912,1890,Woman with Birds,Watercolor Watercolor on paper Framed: 40 1/2 x 34 3/4 x 3/4 in. 102.87 x 88.265 x 1.905 cm; Image and sheet: 28 x 22 in. 71.12 x 55.88 cm Purchased with funds provided by Mr. and Mrs. Thomas H. Crawford Jr.,http://collectionsonline.lacma.org/MWEBimages/all%20departments/full/M2005_115_1.jpg,ef20a59651ae
