Accessories4054,Fax4456,Accepted4257,file_name,International4179,Listings4236,Top6679,Price4278,Since4201,Name4205,Seller4245,Name4209,9864184,Seller4181,Company4197,State4214,Listings4241,On6622,Zip4218,Seller4193,guns4252,Description4273,Mounts4322,Price4546,0077,Phone4225,Categories4043,International6625,Fax4229
Ammo - English Collectible,,"Visa, MC, AMEX, Check, Cashiers and Money Order",85DBFCF8589DFF047157447C0FBB0D96095E218530D3E79238FA4F9EE3D7B450.html,100530299,,"clear=""all"">      Privacy Policy  -  User Agreement  -  FAQs  -  Contact Us           2006 - 2015 all rights reserved. | Guns International.com 2                         Close    Tell a Friend About Us                     $(function(){ $(""#header_tell_friend_form"").submit(function(){ dataString = $(""#header_tell_friend_form"").serialize(); $.ajax({ type: ""POST"", url: ""//www.gunsinternational.com/functions/tell_friend_contact.cfm?act=send"", data: dataString, dataType: ""json"", success: function(data) { if(data.error_contact_detail == false){ $(""#header_tell_friend_target_div"").load(""//www.gunsinternational.com/functions/tell_friend_contact.cfm?act=fin""); } else { $(""#header_tell_friend_target_div"").load(""//www.gunsinternational.com/functions/tell_friend_contact.cfm?act=load""); } } }); return false; }); }); $('#header_tell_friend').on('show.bs.modal', function (event) { $(""#header_tell_friend_target_div"").load(""//www.gunsinternational.com/functions/tell_friend_contact.cfm?act=load""); });           function do_want() { var get_vars = document.location.search; if(get_vars.search(""contact_error"") > 0){ $( ""#contact_btn"" ).trigger( ""click"" ); load_captcha(); } };",750.00,10/24/08,,,,- Ammo - English Collectible Ammo - English Rifle,AM21,Griffin & Howe,New Jersey,,2015,07924,Griffin & Howe,"3 days, Cancellations and Returns may be subject to a re-stocking charge.","   1 pack of 10 boxes (5 rds each / 50 total) 450 3 1/4 case Nitro Express cartridges. Completely packed and sealed. 480 gr. metal covered solid bullet. Green label     Price:  $750.00                     .detail_img_t { margin-bottom:4px;}   Click Photo to Enlarge                  Guns International #: 100530299   Seller's Inventory #: AM21         Category -  Ammo - English Collectible   -  Ammo - English Rifle      Category  Ammo - English Collectible    Ammo - English Rifle                  Seller's Information         When emailing or calling sellers direct, please mention that you saw their listing on GunsInternational.com           Seller:     Griffin & Howe         Company:     Griffin & Howe         Member Since:    10/24/08        State:     New Jersey         Zip:     07924         Country:     United States         Phone:    (908) 766-2287            Platinum Seller         Seller:    FFL Dealer        Return Policy:    3 day inspection and return policy on used guns",Ammo - English Rifle,750.00,"Kynoch .450 NE 3.25""",(908) 766-2287,Gun Parts & Accessories,node2,
Reloading Equipment and Tools - Antique,540-687-5649,"amex, visa, mastercard and check",8661730E7932806686855E3A0C242DFE2B41A1ED1C5322CA44CEB5146717517E.html,100432644,434,"clear=""all"">      Privacy Policy  -  User Agreement  -  FAQs  -  Contact Us           2006 - 2015 all rights reserved. | Guns International.com cc 1                         Close    Tell a Friend About Us                     $(function(){ $(""#header_tell_friend_form"").submit(function(){ dataString = $(""#header_tell_friend_form"").serialize(); $.ajax({ type: ""POST"", url: ""//www.gunsinternational.com/functions/tell_friend_contact.cfm?act=send"", data: dataString, dataType: ""json"", success: function(data) { if(data.error_contact_detail == false){ $(""#header_tell_friend_target_div"").load(""//www.gunsinternational.com/functions/tell_friend_contact.cfm?act=fin""); } else { $(""#header_tell_friend_target_div"").load(""//www.gunsinternational.com/functions/tell_friend_contact.cfm?act=load""); } } }); return false; }); }); $('#header_tell_friend').on('show.bs.modal', function (event) { $(""#header_tell_friend_target_div"").load(""//www.gunsinternational.com/functions/tell_friend_contact.cfm?act=load""); });           function do_want() { var get_vars = document.location.search; if(get_vars.search(""contact_error"") > 0){ $( ""#contact_btn"" ).trigger( ""click"" ); load_captcha(); } };","2,400",9/24/08,Britton,FFL Dealer,Condon,- Reloading Equipment and Tools - Antique Gun Parts - Collectible German Military,25192,"David Condon, Inc.",Virginia,1569,2015,20118,"David Condon, Inc.",5 days," EXCEPTIONAL GERMAN DONUT WHEELOCK RIFLE POWDER FLASK CA. 1580-1600. 5” diameter fruitwood flask with engraved stag horn inlays overall. 2” horn spout nicely engraved in a floral motif and with the original stopper which is inlaid as well. Horn lanyard rings. Excellent overall with some minor losses and no modern restorations. Retains the original finish and the stopper which is very rarely present. Also very ornate with almost full coverage inlays. Extra fine example.     Price:  $2,400                     .detail_img_t { margin-bottom:4px;}   Click Photo to Enlarge                                      Guns International #: 100432644   Seller's Inventory #: 25192         Category -  Reloading Equipment and Tools - Antique  -  Gun Parts - Collectible German Military      Category  Reloading Equipment and Tools - Antique   Gun Parts - Collectible German Military                  Seller's Information         When emailing or calling sellers direct, please mention that you saw their listing on GunsInternational.com           Seller:     David Condon, Inc",Gun Parts - Collectible German Military,"2,400",EXCEPTIONAL GERMAN DONUT WHEELOCK RIFLE POWDER FLASK CA. 1580-1600.,540-687-5642,Gun Parts & Accessories,node1,540-687-5649
Clips & Magazines - Pistol,,Cashier's Check,87F35F650FCC08892BEE46CF93EFA8122CF2EF1EBFB303759427BD4943C2CE49.html,100613986,7,"clear=""all"">      Privacy Policy  -  User Agreement  -  FAQs  -  Contact Us           2006 - 2015 all rights reserved. | Guns International.com 2                         Close    Tell a Friend About Us                     $(function(){ $(""#header_tell_friend_form"").submit(function(){ dataString = $(""#header_tell_friend_form"").serialize(); $.ajax({ type: ""POST"", url: ""//www.gunsinternational.com/functions/tell_friend_contact.cfm?act=send"", data: dataString, dataType: ""json"", success: function(data) { if(data.error_contact_detail == false){ $(""#header_tell_friend_target_div"").load(""//www.gunsinternational.com/functions/tell_friend_contact.cfm?act=fin""); } else { $(""#header_tell_friend_target_div"").load(""//www.gunsinternational.com/functions/tell_friend_contact.cfm?act=load""); } } }); return false; }); }); $('#header_tell_friend').on('show.bs.modal', function (event) { $(""#header_tell_friend_target_div"").load(""//www.gunsinternational.com/functions/tell_friend_contact.cfm?act=load""); });           function do_want() { var get_vars = document.location.search; if(get_vars.search(""contact_error"") > 0){ $( ""#contact_btn"" ).trigger( ""click"" ); load_captcha(); } };",125,1/12/14,Charles,FFL Dealer,Miles,- Clips & Magazines - Pistol Clips & Magazines - European,7100,Gold Coast Pawn,Texas,60,2015,75762,Gold Coast Pawn,," 13 Clips All Factory Original New Condition  1 BERETTA 22Lr  1 GLOCK 45  2 GLOCK 19 9MM  2 SIG MOSQUITO 22lr  1 SPRINGFIELD XDM 45 AUTO  1 RUGER SR 45 45 AUTO  1 RUGER SER 40C 40 SW  2 WALTHER PK 380  1 TANGFOLIO TA90 9mm  1 DAVIS P380 380 AUTO    SOLD AS LOT ONLY, FIRST $125 PRICE INCLUDES SHIPPING AND INSURANCE          Price:  $125                     .detail_img_t { margin-bottom:4px;}   Click Photo to Enlarge                                                  Guns International #: 100613986   Seller's Inventory #: 7100         Category -  Clips & Magazines - Pistol  -  Clips & Magazines - European      Category  Clips & Magazines - Pistol   Clips & Magazines - European                  Seller's Information         When emailing or calling sellers direct, please mention that you saw their listing on GunsInternational.com           Seller:     Gold Coast Pawn         Company:     Gold Coast Pawn         Member Since:    1/12/14        First Name:     Charles         Last Name:     Miles         State:     Texas         Zip:     75762         Country:     United States         Phone:    850-525-1353        Fax:                Number of Active Listings:    7        Total Number of Listings:    60        Seller:    FFL Dealer        Return Policy:    3 day inspection and return policy on used guns",Clips & Magazines - European,125,"BERETTA, GLOCK, WALTHER, SIG, RUGER, SPRINGFIELD CLIPS",850-525-1353,Gun Parts & Accessories,node2,
Civil War Collectibles,218-739-4599,"Money orders, cashier or personal checks",8EC20A6407D677202FA22C1115A8C993BE4F6F74CD379E9258492D8FFDFC655A.html,100585713,894,"clear=""all"">      Privacy Policy  -  User Agreement  -  FAQs  -  Contact Us           2006 - 2015 all rights reserved. | Guns International.com cc 1                         Close    Tell a Friend About Us                     $(function(){ $(""#header_tell_friend_form"").submit(function(){ dataString = $(""#header_tell_friend_form"").serialize(); $.ajax({ type: ""POST"", url: ""//www.gunsinternational.com/functions/tell_friend_contact.cfm?act=send"", data: dataString, dataType: ""json"", success: function(data) { if(data.error_contact_detail == false){ $(""#header_tell_friend_target_div"").load(""//www.gunsinternational.com/functions/tell_friend_contact.cfm?act=fin""); } else { $(""#header_tell_friend_target_div"").load(""//www.gunsinternational.com/functions/tell_friend_contact.cfm?act=load""); } } }); return false; }); }); $('#header_tell_friend').on('show.bs.modal', function (event) { $(""#header_tell_friend_target_div"").load(""//www.gunsinternational.com/functions/tell_friend_contact.cfm?act=load""); });           function do_want() { var get_vars = document.location.search; if(get_vars.search(""contact_error"") > 0){ $( ""#contact_btn"" ).trigger( ""click"" ); load_captcha(); } };",300.,10/27/09,LeRoy,FFL Dealer,Merz,- Civil War Collectibles Gun Accessories,F1005,Merz Antique Guns,Minnesota,11675,2015,56538-0494,LeRoy Merz Antique Guns,3 days," Number 1033 in Rilings book. Flask is unmarked but of A F  C Co. manufacture. Has a plain Common top. Flask is missing spring, collar screws and adjustment stop screw. It has also been repaired along one side of the seam. Rabbit or hare pattern on both sides, 2 eyelets. Has a butterscotch patina.    Leroy Merz Antique Firearms specializes in antique and vintage Winchesters and other fine American firearms. Since 1965 Mr. Merz has taken part in the world of firearms and has been a contributor to many well known reference books. Just recently we mailed the 125th edition of our privately-published catalog. We have hundreds of additional guns in every price range at our home online. Search for Merz Antiques in google",Gun Accessories,300.,AMERICAN FLASK & CAP CO. POWDER FLASK,218-739-3255,Gun Parts & Accessories,node1,218-739-4599
Optics - American,,CERTIFIED FUNDS,9107FACFBDF35C7E0F33A2E7BB1470693DD67A7F516006AE7A929FD8A20FB1DA.html,100615186,,"clear=""all"">      Privacy Policy  -  User Agreement  -  FAQs  -  Contact Us           2006 - 2015 all rights reserved. | Guns International.com 2                         Close    Tell a Friend About Us                     $(function(){ $(""#header_tell_friend_form"").submit(function(){ dataString = $(""#header_tell_friend_form"").serialize(); $.ajax({ type: ""POST"", url: ""//www.gunsinternational.com/functions/tell_friend_contact.cfm?act=send"", data: dataString, dataType: ""json"", success: function(data) { if(data.error_contact_detail == false){ $(""#header_tell_friend_target_div"").load(""//www.gunsinternational.com/functions/tell_friend_contact.cfm?act=fin""); } else { $(""#header_tell_friend_target_div"").load(""//www.gunsinternational.com/functions/tell_friend_contact.cfm?act=load""); } } }); return false; }); }); $('#header_tell_friend').on('show.bs.modal', function (event) { $(""#header_tell_friend_target_div"").load(""//www.gunsinternational.com/functions/tell_friend_contact.cfm?act=load""); });           function do_want() { var get_vars = document.location.search; if(get_vars.search(""contact_error"") > 0){ $( ""#contact_btn"" ).trigger( ""click"" ); load_captcha(); } };",150.,7/18/07,MIKE,,,- Optics - American,,,New York,,2015,,MICHAEL,," LYMAN ALL AMERICAN 4x POST NICE CLEAR OPTICS SHIPPING $10.     Price:  $150.                     .detail_img_t { margin-bottom:4px;}   Click Photo to Enlarge                  Guns International #: 100615186           Category -  Optics - American  -        Category  Optics - American                     Seller's Information         When emailing or calling sellers direct, please mention that you saw their listing on GunsInternational.com           Seller:     MICHAEL         Member Since:    7/18/07        First Name:     MIKE         State:     New York         Country:     United States         Phone:    585-591-0719            Premium Seller         Seller:    Private Seller        Return Policy:    3 day inspection and return policy on used guns",,150.,LYMAN ALL AMERICAN 4x POST,585-591-0719,Gun Parts & Accessories,node2,
Knives,,"Personal Check, Money Order",99F2DE5179CFC6FA3FC35F96FAD97B417AE924B099C54D2BC7673591FC7AAFA0.html,100594198,,"clear=""all"">      Privacy Policy  -  User Agreement  -  FAQs  -  Contact Us           2006 - 2015 all rights reserved. | Guns International.com 2                         Close    Tell a Friend About Us                     $(function(){ $(""#header_tell_friend_form"").submit(function(){ dataString = $(""#header_tell_friend_form"").serialize(); $.ajax({ type: ""POST"", url: ""//www.gunsinternational.com/functions/tell_friend_contact.cfm?act=send"", data: dataString, dataType: ""json"", success: function(data) { if(data.error_contact_detail == false){ $(""#header_tell_friend_target_div"").load(""//www.gunsinternational.com/functions/tell_friend_contact.cfm?act=fin""); } else { $(""#header_tell_friend_target_div"").load(""//www.gunsinternational.com/functions/tell_friend_contact.cfm?act=load""); } } }); return false; }); }); $('#header_tell_friend').on('show.bs.modal', function (event) { $(""#header_tell_friend_target_div"").load(""//www.gunsinternational.com/functions/tell_friend_contact.cfm?act=load""); });           function do_want() { var get_vars = document.location.search; if(get_vars.search(""contact_error"") > 0){ $( ""#contact_btn"" ).trigger( ""click"" ); load_captcha(); } };","1,995.00",2/26/07,Michael,,Merker,- Knives Knives - Custom,,Michael Merker Riflemakers,North Carolina,,2015,,mmriflemakers,3 days," KA-BAR  GRIZZLY  UNION CUTLERY CO. FOLDING STAG HUNTER AUTOMATIC KNIFE. 1930S PRODUCTION.5 1/2 SINGLE FLAT GROUND CLIP BLADE APPEARS FULL.NICKEL SILVER BOLSTERS.PRETTY SLAB STAG HANDLES WITH 1 SMALL CRACK AT CORNER PIN (SE PHOTO)ES IN SOFT LEATHER INDIAN STYLE POUCH. 1995.00 PLUS 20.00 SHIPPING.CHECKS TAKE 10 DAYS TO CLEAR,M/OS TAKE 5 DAYS TO CLEAR.NO CREDIT CARDS TAKEN.CALL DANNY AT 828-698-8804 IF NEEDED.GOD BLESS!     Price:  $1,995.00                     .detail_img_t { margin-bottom:4px;}   Click Photo to Enlarge                                                      Guns International #: 100594198           Category -  Knives  -  Knives - Custom      Category  Knives   Knives - Custom                  Seller's Information         When emailing or calling sellers direct, please mention that you saw their listing on GunsInternational.com           Seller:     mmriflemakers         Company:     Michael Merker Riflemakers         Member Since:    2/26/07        First Name:     Michael         Last Name:     Merker         State:     North Carolina         Country:     United States         Phone:    828-698-8804            Platinum Seller         Seller:    FFL Dealer        Return Policy:    3 day inspection and return policy on used guns",Knives - Custom,"1,995.00","KA-BAR ""GRIZZLY"" UNION CUTLERY CO.FOLDING STAG HUNTER AUTOMATIC KNIFE.1930'S",828-698-8804,Gun Parts & Accessories,node2,
Reloading Components - American,540-687-5649,"amex, visa, mastercard and check",A3EE469C0571856375787E7C64479CD7C481F26828030ECFB6ABAF0916F39F8D.html,100599816,434,"clear=""all"">      Privacy Policy  -  User Agreement  -  FAQs  -  Contact Us           2006 - 2015 all rights reserved. | Guns International.com 2                         Close    Tell a Friend About Us                     $(function(){ $(""#header_tell_friend_form"").submit(function(){ dataString = $(""#header_tell_friend_form"").serialize(); $.ajax({ type: ""POST"", url: ""//www.gunsinternational.com/functions/tell_friend_contact.cfm?act=send"", data: dataString, dataType: ""json"", success: function(data) { if(data.error_contact_detail == false){ $(""#header_tell_friend_target_div"").load(""//www.gunsinternational.com/functions/tell_friend_contact.cfm?act=fin""); } else { $(""#header_tell_friend_target_div"").load(""//www.gunsinternational.com/functions/tell_friend_contact.cfm?act=load""); } } }); return false; }); }); $('#header_tell_friend').on('show.bs.modal', function (event) { $(""#header_tell_friend_target_div"").load(""//www.gunsinternational.com/functions/tell_friend_contact.cfm?act=load""); });           function do_want() { var get_vars = document.location.search; if(get_vars.search(""contact_error"") > 0){ $( ""#contact_btn"" ).trigger( ""click"" ); load_captcha(); } };","1,500",9/24/08,Britton,FFL Dealer,Condon,- Reloading Components - American Accessories - American,25869,"David Condon, Inc.",Virginia,1569,2015,20118,"David Condon, Inc.",5 days, COLT’S PATENT E. PLURIBUS UNUM MODEL 1849 POCKET FLASK CIRCA 1850’S. RAPLEY #F6. 4 ½” flask for the early Colt Model 1849 percussion pocket revolvers. Exceptional example. Best one we have seen not already in a case. Perfect scene and excellent deep patina with original lacquer particularly in the scene. 100% original in every respect including the spring and in fine working order. Sound side seams. Suitable for casing with any Model 1849 of the period in fine to near mint condition,Accessories - American,"1,500",COLT’S PATENT E. PLURIBUS UNUM MODEL 1849 POCKET FLASK CIRCA 1850’S. RAPLEY #F6.,540-687-5642,Gun Parts & Accessories,node2,540-687-5649
Accessories - Metric,845-314-9670,,A72E8DE15BB8F9D311CC3E2DD85199D9DA193211BD147DD30A8E6F5EB8F42E8B.html,100073330,,,40.00     Manufacturer:  0    Model:  0    Serial Number:  0    Caliber:  0    Bore:  0    Chambers:  0    Ejectors:  0    Condition:  0    Metal Condition:  0    Wood Condition:  0    Bore Condition:  0    Barrels:  0    Barrel Type:  0    Action:  0    Triggers:  0    Gauge:  0    Stock:  0    Stock Dimensions:   0    Stock Drop:  0    Stock Comb:  0    Stock Heel:  0    Stock Cast:  0    Fore End:  0    Butt Pad:  0    LOP:  0    Rib:  0    Finish:  0    Weight:  0    Sights:  0    Manufacture Date:  0    Chokes:  0    Choke Left:  0    Choke Right:  0    Engraving:  0    Extras:  0    Case:  0    Item Location:  0    Proof:Nitro:  0    Proof:Black:  0    Minimum Wall Thickness Left:  0    Minimum Wall Thickness Right:  0,2/25/07,Joseph,,Martinelli,- Accessories - Metric Ammo - Metric Collectible,"Ammo. SB, 8x57JRS",J-Mar Enterprises,Pennsylvania,,,,J-Mar,3 days,"  New Production. SB, 8x57JRS (.323), 196 grs, HPC, 20 pack. Go to DrillingHotLine/ammo.pdf for the complete list",Ammo - Metric Collectible,40.00     Manufacturer:  0    Model:  0    Serial Number:  0    Caliber:  0    Bore:  0    Chambers:  0    Ejectors:  0    Condition:  0    Metal Condition:  0    Wood Condition:  0    Bore Condition:  0    Barrels:  0    Barrel Type:  0    Action:  0    Triggers:  0    Gauge:  0    Stock:  0    Stock Dimensions:   0    Stock Drop:  0    Stock Comb:  0    Stock Heel:  0    Stock Cast:  0    Fore End:  0    Butt Pad:  0    LOP:  0    Rib:  0    Finish:  0    Weight:  0    Sights:  0    Manufacture Date:  0    Chokes:  0    Choke Left:  0    Choke Right:  0    Engraving:  0    Extras:  0    Case:  0    Item Location:  0    Proof:Nitro:  0    Proof:Black:  0    Minimum Wall Thickness Left:  0    Minimum Wall Thickness Right:  0,"Sellier & Bellot, 8x57JRS",845-781-3857,Gun Parts & Accessories,,845-314-9670
Art,,"Personal Check, Cashiers Check, USPS Money Order",ADF77A4B8F201C641EF65E9CA8863D4BCC45933A932F36BB8184A6F0C7893539.html,100571212,172,"clear=""all"">      Privacy Policy  -  User Agreement  -  FAQs  -  Contact Us           2006 - 2015 all rights reserved. | Guns International.com cc 1                         Close    Tell a Friend About Us                     $(function(){ $(""#header_tell_friend_form"").submit(function(){ dataString = $(""#header_tell_friend_form"").serialize(); $.ajax({ type: ""POST"", url: ""//www.gunsinternational.com/functions/tell_friend_contact.cfm?act=send"", data: dataString, dataType: ""json"", success: function(data) { if(data.error_contact_detail == false){ $(""#header_tell_friend_target_div"").load(""//www.gunsinternational.com/functions/tell_friend_contact.cfm?act=fin""); } else { $(""#header_tell_friend_target_div"").load(""//www.gunsinternational.com/functions/tell_friend_contact.cfm?act=load""); } } }); return false; }); }); $('#header_tell_friend').on('show.bs.modal', function (event) { $(""#header_tell_friend_target_div"").load(""//www.gunsinternational.com/functions/tell_friend_contact.cfm?act=load""); });           function do_want() { var get_vars = document.location.search; if(get_vars.search(""contact_error"") > 0){ $( ""#contact_btn"" ).trigger( ""click"" ); load_captcha(); } };","6,500.00",2/25/15,Jacob,Private Seller,Hranowskyj,- Art Civil War Collectibles,,,Virginia,203,2015,22611,Jacob Hranowskyj,," A fine original oil painting on canvas of Captain John Lewis Brooke MD CSA 13th Va. Regiment Co. D Louisa Blues. Painted in 1905 from a daugerotype photograph by Willis Pepoon. The actual painting measures 30 inches tall and 25 inches wide. The outside frame dimesions are 36 1/4 inches by 31 1/4 inches. The original photograph was taken the morning after the battle of Winchester, Va. July 1862. The painting remains in fine condition with no repairs or restoration. Capt. Brooke was a doctor for the 13th Va. Infantry Regiment. He was born in 1824 and died in 1869. The painting depicts Capt. Brooke in a relaxed pose in his Confederate uniform. His CSA buckle and buttons are easily identified in the painting. This painting was most likely commisioned by a family member in 1905. The 13th Va. Louisa Blues was part of the 16th Va. Cavalry as its nucleus... with prominent commanders of Colonels George A. Goodman, Ambrose P. Hill, James B. Terrill, James A. Walker and Majors Charles T. Crittenden and John B. Sherrard... Brigades of the Army of Northern Va. They were present and fought at the battles of First Manassas, Jacksons Valley Campaign, Seven Days, Cold Harbor, Cedar Mountain, Cross Keys, Port Republic, Gaines Mill, Second Manassas, Fredericksburg, Chancellorsville, Winchester, Cedar Creek among many others. The Volunteer force was gathered in 1861 commisioned at Harpers Ferry and comprised of men mainly from Winchester, Louisa, Culpeper and Hampshire Counties of Virginia. His father was also a doctor and previous family were from Fauquier County and Culpeper. There is a wealth of information online of the 13th Va. Regiment. Willis Pepoon was a noted American artist/painter born 1859 died 1940 and a Washington DC native and was most known for his commisioned portraits. Paintings of his are in Museums including the Smithsonian, College of William  Mary, VMI. A fine historical painting with Confederate provenance. USPS priority shipping crated and boxed is 100.00     Price:  $6,500.00                     .detail_img_t { margin-bottom:4px;}   Click Photo to Enlarge                                              Guns International #: 100571212           Category -  Art  -  Civil War Collectibles      Category  Art   Civil War Collectibles                  Seller's Information         When emailing or calling sellers direct, please mention that you saw their listing on GunsInternational.com           Seller:     Jacob Hranowskyj         Company:             Member Since:    2/25/15        First Name:     Jacob         Last Name:     Hranowskyj         State:     Virginia         Zip:     22611         Country:     United States         Phone:    (804) 479-7075        Fax:                Platinum Seller         Number of Active Listings:    172        Total Number of Listings:    203        Seller:    Private Seller        Return Policy:    3 day inspection and return policy on used guns",Civil War Collectibles,"6,500.00",Original Oil Painting of Captain John Lewis Brooke CSA 13th Va. Regiment Co. D,(804) 479-7075,Gun Parts & Accessories,node1,
