Accessories4054,Fax4456,Accepted4257,file_name,International4179,Listings4236,Top6679,Price4278,Since4201,Name4205,Seller4245,Name4209,9864184,Seller4181,Company4197,State4214,Listings4241,On6622,Zip4218,Seller4193,guns4252,Description4273,Mounts4322,Price4546,0077,Phone4225,Categories4043,International6625,Fax4229
Winchester Rifles - Model 43,716-941-3946,"POSTAL MONEY ORDERS,BANK CASHIERS CHECK OR PERSONAL CHECKS PERSONAL CHECKS DELAY SHIPPING BY 5 BUSINESS DAYS",67F52BF5A2A976EE5032BA9FD7F23F715DFB67DD89785045F08733DC68B8C087.html,100613430,,"clear=""all"">      Privacy Policy  -  User Agreement  -  FAQs  -  Contact Us           2006 - 2015 all rights reserved. | Guns International.com 2                         Close    Tell a Friend About Us                     $(function(){ $(""#header_tell_friend_form"").submit(function(){ dataString = $(""#header_tell_friend_form"").serialize(); $.ajax({ type: ""POST"", url: ""//www.gunsinternational.com/functions/tell_friend_contact.cfm?act=send"", data: dataString, dataType: ""json"", success: function(data) { if(data.error_contact_detail == false){ $(""#header_tell_friend_target_div"").load(""//www.gunsinternational.com/functions/tell_friend_contact.cfm?act=fin""); } else { $(""#header_tell_friend_target_div"").load(""//www.gunsinternational.com/functions/tell_friend_contact.cfm?act=load""); } } }); return false; }); }); $('#header_tell_friend').on('show.bs.modal', function (event) { $(""#header_tell_friend_target_div"").load(""//www.gunsinternational.com/functions/tell_friend_contact.cfm?act=load""); });           function do_want() { var get_vars = document.location.search; if(get_vars.search(""contact_error"") > 0){ $( ""#contact_btn"" ).trigger( ""click"" ); load_captcha(); } };",895.00     Curio/Relic:  Yes,7/15/07,MAX,FFL Dealer,FRANCE,- Winchester Rifles - Model 43,,MAX T. FRANCE,New York,3575,2015,14033,MAX T. FRANCE,3 days," WINCHESTER MODEL 43 STANDARD GRADE CALIBER 218 BEE. BARREL BLUE 99% RECEIVER BLUE 85%, WOOD EXCELLENT, SCOPE WEAVER 4 POWER. SERIAL NUMBER 24,XXX NON FACTORY DRILL AND TAPPED FOR SCOPE. REAR BRIDGE AND BARREL. BORE MINT. FACTORY HOOD AND FRONT SIGHT NO MIDDLE SIGHT. NEED MORE INFORMATION BEST TO CALL OUR OFFICE 716-941-3946     Price:  $895.00     Curio/Relic:  Yes                   .detail_img_t { margin-bottom:4px;}   Click Photo to Enlarge                                                      Guns International #: 100613430           Category -  Winchester Rifles - Model 43  -        Category  Winchester Rifles - Model 43                     Seller's Information         When emailing or calling sellers direct, please mention that you saw their listing on GunsInternational.com           Seller:     MAX T. FRANCE         Company:     MAX T. FRANCE         Member Since:    7/15/07        First Name:     MAX         Last Name:     FRANCE         State:     New York         Zip:     14033         Country:     United States         Phone:    716-941-3946        Fax:    716-941-3946            Platinum Seller         Total Number of Listings:    3575        Seller:    FFL Dealer        Return Policy:    3 day inspection and return policy on used guns",,895.00     Curio/Relic:  Yes,WINCHESTER MODEL 43 218 BEE,716-941-3946,Rifles,node2,716-941-3946
Civil War Collectibles,218-739-4599,"Money orders, cashier or personal checks",6E778CAB5ED9D8ADEB361B8D319916B844CC03260606A9F9605D95A045645CD3.html,100585713,902,"clear=""all"">      Privacy Policy  -  User Agreement  -  FAQs  -  Contact Us           2006 - 2015 all rights reserved. | Guns International.com 2                         Close    Tell a Friend About Us                     $(function(){ $(""#header_tell_friend_form"").submit(function(){ dataString = $(""#header_tell_friend_form"").serialize(); $.ajax({ type: ""POST"", url: ""//www.gunsinternational.com/functions/tell_friend_contact.cfm?act=send"", data: dataString, dataType: ""json"", success: function(data) { if(data.error_contact_detail == false){ $(""#header_tell_friend_target_div"").load(""//www.gunsinternational.com/functions/tell_friend_contact.cfm?act=fin""); } else { $(""#header_tell_friend_target_div"").load(""//www.gunsinternational.com/functions/tell_friend_contact.cfm?act=load""); } } }); return false; }); }); $('#header_tell_friend').on('show.bs.modal', function (event) { $(""#header_tell_friend_target_div"").load(""//www.gunsinternational.com/functions/tell_friend_contact.cfm?act=load""); });           function do_want() { var get_vars = document.location.search; if(get_vars.search(""contact_error"") > 0){ $( ""#contact_btn"" ).trigger( ""click"" ); load_captcha(); } };",300.,10/27/09,LeRoy,FFL Dealer,Merz,- Civil War Collectibles Gun Accessories,F1005,Merz Antique Guns,Minnesota,11695,2015,56538-0494,LeRoy Merz Antique Guns,3 days," Number 1033 in Rilings book. Flask is unmarked but of A F  C Co. manufacture. Has a plain Common top. Flask is missing spring, collar screws and adjustment stop screw. It has also been repaired along one side of the seam. Rabbit or hare pattern on both sides, 2 eyelets. Has a butterscotch patina.    Leroy Merz Antique Firearms specializes in antique and vintage Winchesters and other fine American firearms. Since 1965 Mr. Merz has taken part in the world of firearms and has been a contributor to many well known reference books. Just recently we mailed the 125th edition of our privately-published catalog. We have hundreds of additional guns in every price range at our home online. Search for Merz Antiques in google",Gun Accessories,300.,AMERICAN FLASK & CAP CO. POWDER FLASK,218-739-3255,Gun Parts & Accessories,node2,218-739-4599
Gun Parts - AR-15 Upper Parts,401-738-9912,All Major Credit Cards,6FB61511ACBBB957FBF9CBCAE3F1588AEB1BE869E3D624944DEAEC0EA65A7ADD.html,100345759,697,"clear=""all"">      Privacy Policy  -  User Agreement  -  FAQs  -  Contact Us           2006 - 2015 all rights reserved. | Guns International.com 2                         Close    Tell a Friend About Us                     $(function(){ $(""#header_tell_friend_form"").submit(function(){ dataString = $(""#header_tell_friend_form"").serialize(); $.ajax({ type: ""POST"", url: ""//www.gunsinternational.com/functions/tell_friend_contact.cfm?act=send"", data: dataString, dataType: ""json"", success: function(data) { if(data.error_contact_detail == false){ $(""#header_tell_friend_target_div"").load(""//www.gunsinternational.com/functions/tell_friend_contact.cfm?act=fin""); } else { $(""#header_tell_friend_target_div"").load(""//www.gunsinternational.com/functions/tell_friend_contact.cfm?act=load""); } } }); return false; }); }); $('#header_tell_friend').on('show.bs.modal', function (event) { $(""#header_tell_friend_target_div"").load(""//www.gunsinternational.com/functions/tell_friend_contact.cfm?act=load""); });           function do_want() { var get_vars = document.location.search; if(get_vars.search(""contact_error"") > 0){ $( ""#contact_btn"" ).trigger( ""click"" ); load_captcha(); } };",599.99,10/28/11,,FFL Dealer,,- Gun Parts - AR-15 Upper Parts Barrels - Rifle,,D HUNTING & OUTDOOR LODGE,Rhode Island,3397,2015,,D HUNTING,3 days on used / New guns & access factory warranty," HAVE A CMMG UPPER BBL ASSEMBLY 16 STAINLESS BBL.     Caliber:  5.56x45mm NATO Chamber    Barrel:  16 M4 Profile Barrel, 416 Stainless Steel, 1:9 Twist   Hand Guard:  M4 Hand Guard   Sights/Gas Block: Low Profile Railed Gas Block   Bolt Group:  M16 Bolt Group      Price:  $599.99                     .detail_img_t { margin-bottom:4px;}   Click Photo to Enlarge                  Guns International #: 100345759           Category -  Gun Parts - AR-15 Upper Parts  -  Barrels - Rifle      Category  Gun Parts - AR-15 Upper Parts   Barrels - Rifle                  Seller's Information         When emailing or calling sellers direct, please mention that you saw their listing on GunsInternational.com           Seller:     D HUNTING         Company:     D HUNTING & OUTDOOR LODGE         Member Since:    10/28/11        State:     Rhode Island         Country:     United States         Phone:    401-738-1889        Fax:    401-738-9912            Platinum Seller         Number of Active Listings:    697        Total Number of Listings:    3397        Seller:    FFL Dealer        Return Policy:    3 day inspection and return policy on used guns",Barrels - Rifle,599.99,"CMMG AR15 UPPER RIFLE ASSEMBLY 5.56 S/S BBL 16"" NEW",401-738-1889,Gun Parts & Accessories,node2,401-738-9912
Holsters and Belts - Military,,MONEY ORDERS,7181CC54FAB0E2BC52DA99C817635ABB4AE83C19A614E8112158D23EE9BBFC84.html,100574478,1092,"clear=""all"">      Privacy Policy  -  User Agreement  -  FAQs  -  Contact Us           2006 - 2015 all rights reserved. | Guns International.com cc 1                         Close    Tell a Friend About Us                     $(function(){ $(""#header_tell_friend_form"").submit(function(){ dataString = $(""#header_tell_friend_form"").serialize(); $.ajax({ type: ""POST"", url: ""//www.gunsinternational.com/functions/tell_friend_contact.cfm?act=send"", data: dataString, dataType: ""json"", success: function(data) { if(data.error_contact_detail == false){ $(""#header_tell_friend_target_div"").load(""//www.gunsinternational.com/functions/tell_friend_contact.cfm?act=fin""); } else { $(""#header_tell_friend_target_div"").load(""//www.gunsinternational.com/functions/tell_friend_contact.cfm?act=load""); } } }); return false; }); }); $('#header_tell_friend').on('show.bs.modal', function (event) { $(""#header_tell_friend_target_div"").load(""//www.gunsinternational.com/functions/tell_friend_contact.cfm?act=load""); });           function do_want() { var get_vars = document.location.search; if(get_vars.search(""contact_error"") > 0){ $( ""#contact_btn"" ).trigger( ""click"" ); load_captcha(); } };",165.00,3/28/07,,,,- Holsters and Belts - Military Gun Parts - Military Non-US,967189080,HOME TOWN GUNS,Connecticut,,2015,,HOME TOWN GUNS,3 days," A good but worn WWII leather flap holster, with a front pocket for an extra mag. Leather is soft and the stitching is complete.This vintage war holster can work for a Mauser HSC, Walther PP, Femaru, Sauer, BerettaCZ, Browning, etc. This holster looks European made, and the tab is also good. No markings on this holster.We dont have asite .I prefer money orders or a check. Item ships when funds come in. If you can only pay with a card let me know. I hope you like my wide selection of unusual guns, knives and gun parts. Shipping price determined by zip code. I try to keep the prices affordable, which means I make less money than most dealers. You wont get altitude sickness with my prices! I consistently have the best selection of older guns If you BUY IT NOW you must still contact us for details buy it now doesnt end the sale, it just sends an email telling us you want to buy this gun. A phone call wont secure a sale! Not home many times, the first buyer by email buys the gun !Thissite doesnot close down a sale when you do a BUY IT NOW like Ebay!I can get six buy it nows in an hour, first buyer to email gets the guns, others are in second place! Best to send another email . Sometimes not home to get calls. Some guns are required shipment to a gun dealer near you for a transfer to you when it arrives. With the widest selection of older guns at great prices, We dont have a store, and sell on the internet only",Gun Parts - Military Non-US,165.00,"WWII MILITARYFEMARU, MAUSER HSC, SAUER FLAP HOLSTER",,Gun Parts & Accessories,node1,
Optics,401-738-9912,All Major Credit Cards,767DA93E7D704E6FC7D01E676A9F20C405109E5738A680804D417D0E184A3D1E.html,100370508,691,"clear=""all"">      Privacy Policy  -  User Agreement  -  FAQs  -  Contact Us           2006 - 2015 all rights reserved. | Guns International.com 2                         Close    Tell a Friend About Us                     $(function(){ $(""#header_tell_friend_form"").submit(function(){ dataString = $(""#header_tell_friend_form"").serialize(); $.ajax({ type: ""POST"", url: ""//www.gunsinternational.com/functions/tell_friend_contact.cfm?act=send"", data: dataString, dataType: ""json"", success: function(data) { if(data.error_contact_detail == false){ $(""#header_tell_friend_target_div"").load(""//www.gunsinternational.com/functions/tell_friend_contact.cfm?act=fin""); } else { $(""#header_tell_friend_target_div"").load(""//www.gunsinternational.com/functions/tell_friend_contact.cfm?act=load""); } } }); return false; }); }); $('#header_tell_friend').on('show.bs.modal', function (event) { $(""#header_tell_friend_target_div"").load(""//www.gunsinternational.com/functions/tell_friend_contact.cfm?act=load""); });           function do_want() { var get_vars = document.location.search; if(get_vars.search(""contact_error"") > 0){ $( ""#contact_btn"" ).trigger( ""click"" ); load_captcha(); } };",399.99,10/28/11,,FFL Dealer,,- Optics Optics - American,,D HUNTING & OUTDOOR LODGE,Rhode Island,3399,2015,,D HUNTING,3 days on used / New guns & access factory warranty,"  RECEIVED IN A LARGE AMOUNT OF LEUPOLD MARK AR 3-9X40 RIFLE SCOPES WITH GREEN FIRE AND TMR RETICLE. SCOPES ARE IN STOCK READY TO SHIP.       CALL TO ORDER 401 738 1889       LEUPOLD MARK AR MOD - 3-9x4 0 FIRE-G TMR   Multicoat 4 Tactile power selector One-inch maintube 2nd Generation Argon/Krypton waterproofing Mark AR MOD 1 P5 dial Dual use Quantum Optical System Matte black       Price:  $399.99                     .detail_img_t { margin-bottom:4px;}   Click Photo to Enlarge                      Guns International #: 100370508           Category -  Optics  -  Optics - American      Category  Optics   Optics - American                  Seller's Information         When emailing or calling sellers direct, please mention that you saw their listing on GunsInternational.com           Seller:     D HUNTING         Company:     D HUNTING & OUTDOOR LODGE         Member Since:    10/28/11        State:     Rhode Island         Country:     United States         Phone:    401-738-1889        Fax:    401-738-9912            Platinum Seller         Number of Active Listings:    691        Total Number of Listings:    3399        Seller:    FFL Dealer        Return Policy:    3 day inspection and return policy on used guns",Optics - American,399.99,LEUPOLD MARK AR 3-9X40 FIREDOT TMR RETICLE NEW IN BOX *** ON SALE ***,401-738-1889,Gun Parts & Accessories,node2,401-738-9912
Books and Magazines,218-739-4599,"Money orders, cashier or personal checks",78FE3F0A25B53783AC0AB34505DC447741BA1B72D28289885C9D71082D46D79A.html,100614778,883,"clear=""all"">      Privacy Policy  -  User Agreement  -  FAQs  -  Contact Us           2006 - 2015 all rights reserved. | Guns International.com 2                         Close    Tell a Friend About Us                     $(function(){ $(""#header_tell_friend_form"").submit(function(){ dataString = $(""#header_tell_friend_form"").serialize(); $.ajax({ type: ""POST"", url: ""//www.gunsinternational.com/functions/tell_friend_contact.cfm?act=send"", data: dataString, dataType: ""json"", success: function(data) { if(data.error_contact_detail == false){ $(""#header_tell_friend_target_div"").load(""//www.gunsinternational.com/functions/tell_friend_contact.cfm?act=fin""); } else { $(""#header_tell_friend_target_div"").load(""//www.gunsinternational.com/functions/tell_friend_contact.cfm?act=load""); } } }); return false; }); }); $('#header_tell_friend').on('show.bs.modal', function (event) { $(""#header_tell_friend_target_div"").load(""//www.gunsinternational.com/functions/tell_friend_contact.cfm?act=load""); });           function do_want() { var get_vars = document.location.search; if(get_vars.search(""contact_error"") > 0){ $( ""#contact_btn"" ).trigger( ""click"" ); load_captcha(); } };",85.,10/27/09,LeRoy,FFL Dealer,Merz,- Books and Magazines Books and Magazines,9B,Merz Antique Guns,Minnesota,11706,2015,56538-0494,LeRoy Merz Antique Guns,3 days, By Roy Marcot. Hardcover book with 312 pgs. This is an excellent book covering all of the models made by Remington  history of the company.  Leroy Merz Antique Firearms specializes in antique and vintage Winchesters and other fine American firearms. Since 1965 Mr. Merz has taken part in the world of firearms and has been a contributor to many well known reference books. Just recently we mailed the 124th edition of our privately-published catalog. We have hundreds of additional guns in every price range at our home online. Search for Merz Antiques in google,Books and Magazines,85.,REMINGTON - AMERICAS OLDEST GUNMAKER,218-739-3255,Gun Parts & Accessories,node2,218-739-4599
Grips,2522439845,"Visa, MC, Discover, Paypal (non-gun), USPS money order",79306192CB9A728A0934A091348C2FD03FD43A3F04E98C9B196A1D8B10BCE8B9.html,100552477,1030,"clear=""all"">      Privacy Policy  -  User Agreement  -  FAQs  -  Contact Us           2006 - 2015 all rights reserved. | Guns International.com cc 1                         Close    Tell a Friend About Us                     $(function(){ $(""#header_tell_friend_form"").submit(function(){ dataString = $(""#header_tell_friend_form"").serialize(); $.ajax({ type: ""POST"", url: ""//www.gunsinternational.com/functions/tell_friend_contact.cfm?act=send"", data: dataString, dataType: ""json"", success: function(data) { if(data.error_contact_detail == false){ $(""#header_tell_friend_target_div"").load(""//www.gunsinternational.com/functions/tell_friend_contact.cfm?act=fin""); } else { $(""#header_tell_friend_target_div"").load(""//www.gunsinternational.com/functions/tell_friend_contact.cfm?act=load""); } } }); return false; }); }); $('#header_tell_friend').on('show.bs.modal', function (event) { $(""#header_tell_friend_target_div"").load(""//www.gunsinternational.com/functions/tell_friend_contact.cfm?act=load""); });           function do_want() { var get_vars = document.location.search; if(get_vars.search(""contact_error"") > 0){ $( ""#contact_btn"" ).trigger( ""click"" ); load_captcha(); } };",70.00,11/14/13,Bill,Private Seller,Harvey,- Grips Grips - Pistol,RW110,N.C. Ordnance Inc.,North Carolina,1165,2015,27895,N.C. Ordnance Inc.,Complete Return 7 days full refund less postage; International Shipping Out of US: Countries Limited,"  MAUSER BROOMHANDLE, MODEL 1930    ROYALWOOD REPRODUCTION GRIPS    WITH SCREW SET    Royalwood is the Trade Name for a Synthetic Material (Urethane Polymer)",Grips - Pistol,70.00,"Mauser Broomhandle, M1930 Faux Wood Grips",252-237-2440,Gun Parts & Accessories,node1,2522439845
Accessories - American,540-687-5649,"amex, visa, mastercard and check",7C1BEB12504B15C2254F29ADE07EA3E5E14590CB3AE34077DA3DBB568B981A38.html,100594782,434,"clear=""all"">      Privacy Policy  -  User Agreement  -  FAQs  -  Contact Us           2006 - 2015 all rights reserved. | Guns International.com cc 1                         Close    Tell a Friend About Us                     $(function(){ $(""#header_tell_friend_form"").submit(function(){ dataString = $(""#header_tell_friend_form"").serialize(); $.ajax({ type: ""POST"", url: ""//www.gunsinternational.com/functions/tell_friend_contact.cfm?act=send"", data: dataString, dataType: ""json"", success: function(data) { if(data.error_contact_detail == false){ $(""#header_tell_friend_target_div"").load(""//www.gunsinternational.com/functions/tell_friend_contact.cfm?act=fin""); } else { $(""#header_tell_friend_target_div"").load(""//www.gunsinternational.com/functions/tell_friend_contact.cfm?act=load""); } } }); return false; }); }); $('#header_tell_friend').on('show.bs.modal', function (event) { $(""#header_tell_friend_target_div"").load(""//www.gunsinternational.com/functions/tell_friend_contact.cfm?act=load""); });           function do_want() { var get_vars = document.location.search; if(get_vars.search(""contact_error"") > 0){ $( ""#contact_btn"" ).trigger( ""click"" ); load_captcha(); } };","1,000",9/24/08,Britton,FFL Dealer,Condon,- Accessories - American Reloading Components - American,25860,"David Condon, Inc.",Virginia,1569,2015,20118,"David Condon, Inc.",5 days," EARLY U.S. PUBLIC PROPERTY POWDER FLASK CIRCA LATE 1820’S. RILING #353. 8 ½” o/a. For use with the U.S. Model 1817 Flintlock Common Rifle and various militia rifles of the day. Fine and all original. Top in working order. Superb patina and has the original rings. Superior example for one of these early Martial flasks     Price:  $1,000                     .detail_img_t { margin-bottom:4px;}   Click Photo to Enlarge                                  Guns International #: 100594782   Seller's Inventory #: 25860         Category -  Accessories - American  -  Reloading Components - American      Category  Accessories - American   Reloading Components - American                  Seller's Information         When emailing or calling sellers direct, please mention that you saw their listing on GunsInternational.com           Seller:     David Condon, Inc",Reloading Components - American,"1,000",EARLY U.S. PUBLIC PROPERTY POWDER FLASK CIRCA LATE 1820’S. RILING #353.,540-687-5642,Gun Parts & Accessories,node1,540-687-5649
Actions,1-814-834-9448,"Visa, Mastercard, Discover, Money Order",84CDEA5BABEB947286987A8577F11ECE545C91ADAAF47DE6654B23AE11D80798.html,100592144,1626,"clear=""all"">      Privacy Policy  -  User Agreement  -  FAQs  -  Contact Us           2006 - 2015 all rights reserved. | Guns International.com cc 1                         Close    Tell a Friend About Us                     $(function(){ $(""#header_tell_friend_form"").submit(function(){ dataString = $(""#header_tell_friend_form"").serialize(); $.ajax({ type: ""POST"", url: ""//www.gunsinternational.com/functions/tell_friend_contact.cfm?act=send"", data: dataString, dataType: ""json"", success: function(data) { if(data.error_contact_detail == false){ $(""#header_tell_friend_target_div"").load(""//www.gunsinternational.com/functions/tell_friend_contact.cfm?act=fin""); } else { $(""#header_tell_friend_target_div"").load(""//www.gunsinternational.com/functions/tell_friend_contact.cfm?act=load""); } } }); return false; }); }); $('#header_tell_friend').on('show.bs.modal', function (event) { $(""#header_tell_friend_target_div"").load(""//www.gunsinternational.com/functions/tell_friend_contact.cfm?act=load""); });           function do_want() { var get_vars = document.location.search; if(get_vars.search(""contact_error"") > 0){ $( ""#contact_btn"" ).trigger( ""click"" ); load_captcha(); } };",279.99,5/10/11,,,,- Actions Gun Parts - Rifle Parts,85273,Elk County Ammo and Arms,Pennsylvania,,2015,15857,Elk County Ammo and Arms,3 days,"  Brand New in the Box, Ready to Ship! Buy It Now!!        Superior Strength, Legendary Performance:   Its been many years since the legendary Remington 700 action has been offered by Remington. Remington Arms Co. will release actions to the commercial market only when it is sure it has enough supply to satisfy its own production needs for complete guns. Through a new arrangement with Remington, they are able to offer both Long and Short 700 Actions. This Remington 700 Long Action Ultra Mag Carbon is the Receiver Only. This receiver is not complete and is ideal for the individual who is building a custom rifle from the ground up. The receiver features a factory blued finish. This item is serialized and all FFL rules apply",Gun Parts - Rifle Parts,279.99,Remington Model 700 CS Receiver Rem Ultra Mag Long Action Calibers (Blued) 85273,814-834-9451,Gun Parts & Accessories,node1,1-814-834-9448
